id,gender,masterCategory,subCategory,articleType,baseColour,productDisplayName,
48845,Women,Accessories,Jewellery,Pendant,Silver,Lucera Women Silver Pendant,
47031,Women,Apparel,Topwear,Kurtas,Brown,Shree Women Brown & Mustard Kurta,
15472,Men,Apparel,Topwear,Tshirts,Blue,Puma Men Logo Blue Tshirts,
21647,Women,Apparel,Innerwear,Bra,White,Enamor White Smooth Bra,
4025,Unisex,Footwear,Shoes,Casual Shoes,Red,ADIDAS Unisex High Can Red Black Shoe,
37722,Men,Apparel,Topwear,Shirts,Grey,John Players Men Grey Striped Shirt,
32250,Women,Apparel,Bottomwear,Skirts,Blue,Fabindia Women Blue Skirts,
4819,Men,Apparel,Bottomwear,Shorts,Navy Blue,ADIDAS Men's Team Bermuda Navy Blue Short,
56715,Women,Apparel,Topwear,Kurtas,White,Folklore Women White & Blue Printed Kurta,
24335,Men,Apparel,Topwear,Tshirts,Grey,ADIDAS Men Grey T-shirt,
40670,Women,Apparel,Topwear,Shirts,Grey,Lee Women Grey Printed Shirt,
33382,Women,Accessories,Wallets,Wallets,Pink,Baggit Women Yuvraj Jhuti Pink Wallet,
1557,Unisex,Accessories,Bags,Backpacks,Black,Quechua Spacious Blue-Black Backpack,
13785,Men,Apparel,Bottomwear,Trousers,Black,Belmonte Men Solid Black Trousers,
26462,Men,Apparel,Topwear,Tshirts,Black,Puma Men Black T-shirt,
55190,Women,Personal Care,Nails,Nail Polish,Green,Lakme Absolute Fast & Fabulous Storm Green Nail Polish 07,
12657,Men,Apparel,Topwear,Shirts,White,Probase Men Stripes White Shirts,
42127,Men,Footwear,Flip Flops,Flip Flops,Black,Nike Men Black Celso Solarsoft Thong Flip Flops,
3200,Men,Apparel,Topwear,Tshirts,Green,Tantra Men's Cool Green T-shirt,
17325,Unisex,Accessories,Eyewear,Sunglasses,Brown,Pepe Jeans Unisex Casual Sunglasses,
23110,Men,Accessories,Accessories,Accessory Gift Set,Blue,Turtle Men Formal Blue Tie, Cufflink and Pocket Square Combo Set
6772,Men,Apparel,Topwear,Shirts,Green,Timberland Men Claremont Popl Green Shirt,
47455,Women,Footwear,Shoes,Heels,Purple,Tiptopp Women Purple Flip-Flops,
46587,Women,Footwear,Shoes,Heels,Brown,Catwalk Women Brown Flats,
35075,Men,Accessories,Belts,Belts,Brown,Allen Solly Men Leather Brown Belt,
51530,Women,Accessories,Watches,Watches,Silver,Fastrack Women Silver-Toned Dial Watch NA2404sm01,
27782,Men,Accessories,Wallets,Wallets,Brown,Bulchee Men Brown Wallet,
30735,Men,Apparel,Bottomwear,Churidar,Beige,Fabindia Men Beige Churidar,
9508,Men,Apparel,Bottomwear,Shorts,Black,Puma Men Bermudas Black Shorts,
26650,Men,Footwear,Shoes,Sports Shoes,Blue,Puma Men TX-3 Blue Sports Shoes,
12465,Men,Accessories,Stoles,Stoles,Black,Basics Men Black Checked Stoles,
6540,Men,Apparel,Topwear,Tshirts,Green,Nike Men's Training Green T-shirt,
34395,Men,Apparel,Topwear,Tshirts,Red,Myntra Men Red Torchers T-shirt,
18963,Women,Apparel,Topwear,Sweatshirts,Black,United Colors of Benetton Women Solid Black Sweatshirt,
47667,Women,Accessories,Scarves,Scarves,Green,Femella Women Green & Red Printed Scarf,
17117,Women,Accessories,Bags,Clutches,Black,Lino Perros Women Crystal Black Clutch,
23322,Women,Apparel,Topwear,Kurtas,Brown,W Women Brown Printed Kurta,
51702,Unisex,Accessories,Eyewear,Sunglasses,Grey,Van Heusen Unisex Sunglasses VH220-C3,
7492,Women,Apparel,Bottomwear,Capris,Black,Nike Women Squad Black Capri,
35247,Men,Accessories,Socks,Socks,Red,Manchester United Men Red Socks,
4217,Girls,Apparel,Topwear,Tshirts,Blue,Disney Kids Girl's Blue Disney Jeans Kidswear,
45130,Men,Accessories,Watches,Watches,Black,Casio Enticer Men Silver Analogue Watch MTP-1216A-1BDF(A355),
15640,Men,Apparel,Topwear,Tshirts,White,Nike Men Lebron 3D White Tshirts,
52187,Women,Accessories,Jewellery,Earrings,Silver,Lencia Sterling Silver Earrings,
53055,Women,Apparel,Saree,Sarees,Blue,FNF Blue Printed Sari,
14792,Women,Accessories,Bags,Handbags,Beige,United Colors of Benetton Women Solid Beige Handbags,
56527,Women,Personal Care,Lips,Lipstick,Brown,Streetwear Satin Smooth Plum Brown Lipstick 39,
41590,Men,Apparel,Topwear,Shirts,Green,Basics Men Green Striped Shirt,
40442,Women,Apparel,Dress,Dresses,Grey,La Emotio Women Grey Dress,
38558,Men,Apparel,Topwear,Tshirts,Navy Blue,Nike Men Polo Navy Blue T-shirt,
53869,Women,Footwear,Shoes,Heels,Black,Rocia Women Black Sandals,
1765,Women,Apparel,Topwear,Tshirts,White,Lotto Women White T-shirt,
24107,Men,Footwear,Flip Flops,Flip Flops,Red,Playboy Men Red Flip Flops,
10332,Men,Accessories,Belts,Belts,Brown,Indigo Nation Men cataclasite Brown Belts,
5799,Men,Apparel,Topwear,Tshirts,Green,ADIDAS Men's Bubble Green T-shirt,
57895,Women,Apparel,Topwear,Shirts,Pink,Femella Women Pink Top,
38938,Boys,Apparel,Bottomwear,Shorts,Blue,Gini and Jony Boys Blue Shorts,
53409,Women,Apparel,Topwear,Kurtas,White,Alma Women Printed White Kurta,
59133,Men,Apparel,Topwear,Jackets,Brown,Just Natural Men Brown Reversible Jacket,
56947,Women,Footwear,Shoes,Heels,Gold,HM Women Golden Heels,
37970,Women,Footwear,Shoes,Heels,Black,Clarks Women Chart Leather Black Formal Shoes,
25489,Men,Footwear,Shoes,Casual Shoes,White,Nike Men Backboard White Casual Shoes,
12039,Men,Apparel,Topwear,Shirts,Blue,Mark Taylor Men Blue Shirt,
42749,Women,Footwear,Shoes,Heels,Black,Rocia Women Black Heels,
8086,Men,Footwear,Sandal,Sandals,Grey,ADIDAS Men Terra Sports Syn Grey Sandals,
9154,Women,Apparel,Topwear,Tops,Grey,Jealous 21 Women Checks Grey Tops,
12805,Men,Apparel,Topwear,Tshirts,Grey,Nike Men Grey Polo Tshirts,
29244,Men,Footwear,Shoes,Sports Shoes,White,ADIDAS Men Adi Primo White Sports Shoes,
16499,Men,Apparel,Topwear,Tshirts,Maroon,Locomotive Men Printed Maroon TShirt,
9968,Men,Apparel,Topwear,Tshirts,Black,Nike Men As The Kobe O Black T-Shirts,
28396,Women,Accessories,Eyewear,Sunglasses,Brown,Idee Women Brown Sunglasses,
18731,Women,Apparel,Topwear,Sweaters,Navy Blue,Arrow Woman Georgina 2 Navy Blue Sweater,
50882,Women,Apparel,Saree,Sarees,Mustard,Prafful Mustard Crepe Printed Sari,
9366,Men,Accessories,Socks,Socks,White,Puma Men Ftpa Socks White Socks,
29076,Men,Accessories,Belts,Belts,Brown,Fastrack Men Brown Belt,
26802,Men,Apparel,Topwear,Shirts,Blue,Arrow Men Blue Striped Slim Fit Shirt,
35429,Men,Footwear,Shoes,Sports Shoes,Brown,ADIDAS Men Astride Brown Sports Shoes,
47009,Women,Apparel,Topwear,Kurtas,Brown,Shree Women Brown Kurta,
17779,Men,Accessories,Belts,Belts,Olive,Reid & Taylor Men Olive Belt,
1937,Women,Footwear,Shoes,Sports Shoes,Black,Kalenji Women Black Pink Shoe,
4479,Men,Footwear,Shoes,Sports Shoes,Silver,Puma Men's Ikonis Silver Blue Black Shoe,
59301,Men,Apparel,Topwear,Shirts,Olive,U.S. Polo Assn. Denim Co. Men Olive Shirt,
38336,Girls,Apparel,Topwear,Tops,Pink,Mr. Men Little Miss Girls Pink Top,
24769,Men,Footwear,Flip Flops,Flip Flops,Grey,Spalding Men Grey Flip Flops,
56349,Men,Personal Care,Fragrance,Perfume and Body Mist,Black,Nike Fragrances Men Wood Blast Perfume 150 ml,
15812,Men,Apparel,Innerwear,Briefs,Blue,Facit Men Trophy BKN Blue Briefs,
18355,Men,Accessories,Socks,Socks,White,Fila Men Ankel White Socks,
9702,Men,Footwear,Shoes,Formal Shoes,Brown,Hush Puppies Men Chevelle Brown Formal Shoes,
23914,Men,Footwear,Shoes,Casual Shoes,White,Fila Men Cicadeo White Casual Shoes,
3238,Men,Footwear,Shoes,Sports Shoes,Black,Puma Men Black 65CC Lo Ducati Sports Shoes,
19287,Women,Accessories,Watches,Watches,White,Guess Women Party Girl White Watch,
42923,Women,Accessories,Wallets,Wallets,Black,French Connection Women Black Wallet,
51508,Women,Apparel,Bottomwear,Jeans,Navy Blue,Denizen Women Navy Blue Jeans,
7698,Women,Apparel,Topwear,Tops,Purple,Jealous 21 Women's She's Got Attitude Purple Top,
55994,Women,Personal Care,Lips,Lipstick,Purple,Colorbar Velvet Matte Mulberry Lipstick 27M,
59765,Women,Accessories,Jewellery,Earrings,Gold,Estelle Women Gold Earrings,
14598,Women,Apparel,Bottomwear,Stockings,Purple,United Colors of Benetton Women Solid Purple Stockings,
32268,Women,Apparel,Topwear,Kurtas,Pink,Vishudh Women Printed Pink Kurta,
40648,Women,Apparel,Topwear,Kurtas,Purple,Span Women Purple & Blue Kurta,
38752,Women,Accessories,Bags,Handbags,Black,Nike Women Black Handbag,
10138,Women,Accessories,Watches,Watches,Silver,Esprit Women Spark Pink Silver Watches,
15678,Men,Apparel,Bottomwear,Trousers,Beige,Highlander Men Classic Chinos Beige Trousers,
32866,Unisex,Accessories,Bags,Backpacks,Red,Wildcraft Unisex Red and Grey Backpack,
59557,Women,Accessories,Jewellery,Bangle,Gold,Lucera Gold Plated Bangle,
45108,Men,Accessories,Watches,Watches,Black,CASIO ENTICER Men Black Printed Dial Watch A020 MQ-76-L7A1UL,
37528,Boys,Apparel,Topwear,Rompers,White,Madagascar3 Infant Boys White Snapsuit Romper,
58485,Men,Accessories,Wallets,Wallets,Brown,Fossil Men Brown Wallet,
52983,Women,Apparel,Saree,Sarees,Maroon,FNF Striped Multi Coloured Sari,
45934,Women,Accessories,Watches,Watches,Silver,Maxima Women Silver Dial Watch,
53851,Women,Apparel,Topwear,Kurtas,Green,Vishudh Women Green Printed Kurta,
33188,Women,Apparel,Topwear,Tops,Purple,Sepia Women Purple Top,
38560,Men,Accessories,Headwear,Caps,Black,Nike Men Black Cap,
17913,Men,Apparel,Topwear,Sweatshirts,Grey,Nike Men Casual Grey Sweatshirt,
9530,Men,Apparel,Topwear,Tshirts,White,Nike Men Coolfitted White T-Shirts,
48617,Women,Accessories,Jewellery,Earrings,Silver,Lucera Women Silver Earrings,
18167,Girls,Apparel,Dress,Dresses,Magenta,Doodle Kids Girls Party Frock Purple Dress,
26668,Men,Footwear,Shoes,Casual Shoes,Black,Puma Men Rebound FS Black Casual Shoes,
6578,Men,Apparel,Topwear,Tshirts,Grey,Inkfruit Men's War Dark Grey T-shirt,
19889,Men,Accessories,Belts,Belts,Olive,Lee Men Canvas Olive Belt,
3836,Men,Footwear,Sandal,Sandals,Brown,Crocs Men Santa Cruz Clog Espresso Brown Sandal,
13749,Men,Apparel,Topwear,Shirts,Blue,Belmonte Men Check Blue Shirts,
34957,Women,Apparel,Saree,Sarees,Beige,Fabindia Beige Jaipur Print Cotton Sari,
22832,Men,Footwear,Shoes,Casual Shoes,Brown,Woodland Men Brown Shoes,
49503,Men,Footwear,Shoes,Casual Shoes,Black,Vans Men Black Casual Shoes,
19273,Women,Accessories,Watches,Watches,White,Guess Women Prism White Dial Watch W13564L1,
35885,Boys,Apparel,Topwear,Tshirts,White,Jungle Book Boys Yee-Ha! White T-shirt,
28534,Men,Apparel,Topwear,Tshirts,White,Nike Men Sublimated White T-shirt,
55960,Women,Personal Care,Lips,Lipstick,Purple,Colorbar Take Me As I Am Sizzling Berry Lipcolor With Sharpener 005,
11822,Men,Footwear,Shoes,Casual Shoes,Blue,Playboy Men Casual Blue Casual Shoes,
52379,Women,Apparel,Loungewear and Nightwear,Nightdress,Peach,Red Rose Women Peach Nightdress,
20759,Women,Footwear,Shoes,Flats,Brown,Carlton London Women Casual Brown Sandals,
58643,Women,Apparel,Topwear,Kurtas,Black,ALayna Women Black Kurta,
39674,Men,Footwear,Shoes,Sports Shoes,White,Lotto Men White Sports Shoes,
5907,Men,Apparel,Topwear,Tshirts,Black,Puma Men's Massa Lifestyle Black T-shirt,
25825,Women,Apparel,Topwear,Kurtas,White,Diva Women Printed White Kurta,
53099,Women,Accessories,Jewellery,Earrings,Silver,Fabindia Silver Earrings,
33940,Men,Apparel,Topwear,Tshirts,Orange,ADIDAS Men Orange T-shirt,
58471,Men,Accessories,Wallets,Wallets,Brown,Fossil Men Brown Wallet,
25019,Women,Footwear,Shoes,Casual Shoes,Tan,United Colors of Benetton Women Tan Casual Shoes,
44812,Women,Apparel,Topwear,Tshirts,Purple,Spykar Women Purple T-shirt,
57439,Women,Apparel,Topwear,Tshirts,Pink,Angry Birds Women Pink T-shirt,
38594,Women,Apparel,Topwear,Tshirts,White,Nike Women White Scoop T-shirt,
18193,Men,Apparel,Bottomwear,Jeans,Blue,Deni Yo Men Washed Blue Slim Fit Jeans,
19041,Women,Footwear,Shoes,Heels,Black,Catwalk Women Moccasin Black Casual Shoes,
49731,Men,Accessories,Ties,Ties,Brown,Park Avenue Men Brown Tie,
16835,Women,Accessories,Eyewear,Sunglasses,Black,Idee Women Funky Eyewear Black Sunglasses,
2910,Women,Footwear,Shoes,Heels,Brown,Catwalk Women Wedding Collection Bronze Heels,
28706,Women,Apparel,Topwear,Kurtas,Black,W Women Printed Black Kurta,
34359,Men,Apparel,Topwear,Tshirts,Blue,Myntra Men Blue Banana Diet T-shirt,
46779,Men,Personal Care,Fragrance,Perfume and Body Mist,Orange,Euroluxe Men Frank Perfume,
16009,Men,Apparel,Topwear,Tshirts,Blue,Turtle Stripes Men Blue TShirt,
57861,Women,Personal Care,Skin Care,Sunscreen,Green,Biotique Women Bio Vera Ultra Soothing Body Lotion with SPF 75,
58015,Women,Apparel,Topwear,Tops,White,Latin Quarters Women Pink Printed Top,
41904,Women,Personal Care,Fragrance,Deodorant,Black,Playboy Women Pack of 3 Deos,
45598,Men,Footwear,Shoes,Formal Shoes,Black,Arrow Men Black Formal Shoes,
37984,Men,Apparel,Topwear,Tshirts,Black,Classic Polo Men Black & White T-Shirt,
20933,Women,Accessories,Bags,Handbags,Purple,Fastrack Women Leatherette Purple HandBag,
58829,Women,Accessories,Watches,Watches,Silver,FCUK Women Silver-Toned Dial Watch FC1020SWN,
33518,Women,Footwear,Shoes,Heels,Blue,Cobblerz Women Blue Peep Toes,
39022,Women,Accessories,Watches,Watches,Green,CASIO ENTICER Women Green Dial Analogue Watch A631 ,
11648,Men,Accessories,Watches,Watches,Black,Puma Men Spectrum Black Dial Watch,
19425,Men,Apparel,Topwear,Shirts,Blue,Quiksilver Men Blue Shirt,
7806,Men,Footwear,Shoes,Casual Shoes,White,Puma Men's Basket Classic White Shoe,
49355,Men,Footwear,Shoes,Casual Shoes,Green,Vans Men Green Larkin Shoes,
8072,Women,Footwear,Shoes,Sports Shoes,Grey,New Balance Women Grey Sports Shoes,
2548,Men,Footwear,Flip Flops,Flip Flops,Navy Blue,Numero Uno Men's Casual Navy Blue Flip Flop,
22658,Unisex,Accessories,Bags,Backpacks,Blue,Wildcraft Unisex Blue Printed Backpack,
50278,Men,Footwear,Shoes,Formal Shoes,Brown,Arrow Men Brown Formal Shoes,
28362,Men,Accessories,Eyewear,Sunglasses,Black,Idee Men Black Sunglasses,
13923,Men,Footwear,Shoes,Sports Shoes,Black,Nike Men Dart 9 Leather Black Sports Shoes,
49167,Men,Accessories,Eyewear,Sunglasses,Black,United Colors of Benetton Men Black Sunglasses,
8240,Women,Accessories,Bags,Handbags,Mustard,Fastrack Women Mustard Sling Bag,
19617,Women,Apparel,Topwear,Tops,Blue,United Colors of Benetton Women Solid Blue Top,
55538,Women,Personal Care,Makeup,Eyeshadow,Multi,Revlon Wild Orchids Illuminance Creme Eye Shadow,
9392,Women,Footwear,Shoes,Sports Shoes,White,Nike Women Dow 3 Lea White Sports Shoe,
50876,Women,Apparel,Saree,Sarees,Green,Prafful Green & Beige Crepe Sari,
29082,Men,Accessories,Wallets,Wallets,Black,Fastrack Men Leather Black Wallet,
31841,Men,Accessories,Watches,Watches,White,Titan Men White Dial Watch,
7208,Women,Apparel,Topwear,Tops,White,Jealous 21 Women's Flower Printed White Top,
27924,Women,Apparel,Bottomwear,Trousers,Beige,Scullers For Her Beige Trousers,
28150,Men,Apparel,Innerwear,Innerwear Vests,White,Jockey SPORT Men White Innerwear Vest 9924,
58227,Men,Footwear,Sandal,Sandals,Black,Lotto Men Black Sandals,
14108,Men,Apparel,Topwear,Sweatshirts,Brown,Flying Machine Men Printed Brown Sweatshirts,
44678,Women,Apparel,Topwear,Tops,Pink,Wills Lifestyle Women Pink Top,
36258,Men,Apparel,Loungewear and Nightwear,Night suits,Green,SDL by Sweet Dreams Men Green & Black Pyjama Set,
14934,Men,Apparel,Bottomwear,Shorts,Red,Status Quo Men Check Red Shorts,
39210,Men,Footwear,Shoes,Formal Shoes,Black,Franco Leone Men Black Formal Shoes,
30732,Women,Apparel,Bottomwear,Churidar,Black,Fabindia Women Black Churidar,
27785,Men,Accessories,Wallets,Wallets,Brown,Bulchee Men Brown Wallet,
12462,Men,Apparel,Topwear,Waistcoat,Brown,Basics Men Brown Checked Waistcoat,
26657,Men,Footwear,Shoes,Casual Shoes,Blue,Puma Men G. Vilas 2 Basics Blue Shoes,
23325,Women,Apparel,Topwear,Kurtas,Brown,W Women Brown Printed Kurta,
17110,Women,Accessories,Bags,Clutches,Gold,Lino Perros Women Classic Gold Clutch,
47660,Women,Apparel,Topwear,Tunics,White,Femella Women White Printed Tunic,
6547,Women,Apparel,Topwear,Tshirts,Yellow,Nike Women's Embossed Yellow T-shirt,
18964,Women,Apparel,Topwear,Sweatshirts,Grey,United Colors of Benetton Women Solid Dark Grey Sweatshirt,
34392,Men,Apparel,Topwear,Tshirts,Red,Myntra Men Red Say It Loud T-shirt,
7495,Women,Apparel,Topwear,Tshirts,Purple,Nike Women's Nike Spher Purple T-shirt,
35240,Men,Accessories,Socks,Socks,Red,Manchester United Men Red Socks,
51705,Men,Accessories,Eyewear,Sunglasses,Brown,Van Heusen Men Brown Sunglasses,
3809,Boys,Apparel,Topwear,Tshirts,Red,Disney Kids Boy's He Is Behind You Red Kidswear,
21472,Women,Footwear,Shoes,Casual Shoes,Green,Roxy Women Cute Lime Casual Shoes,
15647,Men,Apparel,Topwear,Tshirts,Black,Nike Men Runng Black Jerseys,
32859,Women,Footwear,Shoes,Heels,Black,Grendha Women Black Flats,
52180,Women,Accessories,Jewellery,Earrings,Silver,Lencia Silver Earrings,
59568,Men,Accessories,Cufflinks,Cufflinks,Steel,Revv Men Black Cufflinks,
45137,Women,Accessories,Watches,Watches,Black,CASIO Enticer Women Black Dial Watch A376 LTP-2037A-1CDF,
4210,Boys,Apparel,Topwear,Tshirts,Blue,Disney Kids Boy's Blue Mickey Mouse Kidswear,
37517,Boys,Accessories,Gloves,Gloves,Yellow,Madagascar 3 Infant Boys Yellow Mittens,
53052,Women,Apparel,Saree,Sarees,Multi,FNF Multi Coloured Printed Sari,
41597,Men,Apparel,Topwear,Shirts,Navy Blue,Basics Men Navy Striped Shirt,
56520,Women,Personal Care,Lips,Lipstick,Brown,Streetwear Satin Smooth Brazen Brown Lipcolor 66,
10335,Women,Apparel,Topwear,Tops,Pink,United Colors of Benetton Women Striped Magenta Top,
24100,Men,Footwear,Sandal,Sandals,Brown,Red Tape Men Brown Casual Sandals,
1762,Women,Apparel,Topwear,Tshirts,Blue,Lotto Women Cathy Blue T-shirt,
4022,Unisex,Footwear,Shoes,Casual Shoes,Green,ADIDAS Unisex Color Blast Green White Shoe,
21640,Women,Apparel,Innerwear,Bra,Black,Enamor Women Lift Black Bra,
15475,Men,Apparel,Topwear,Tshirts,Blue,Puma Men Logo Blue Tshirts,
20792,Men,Apparel,Topwear,Jackets,Beige,Basics Men Beige Blazer Jacket,
37725,Men,Apparel,Topwear,Shirts,Yellow,John Players Men Yellow Check Shirt,
32257,Women,Apparel,Topwear,Tops,Beige,Fabindia Women Printed Beige Ghicha Silk Wrap Top,
33385,Women,Accessories,Wallets,Wallets,Pink,Baggit Women Volume Jhuti Pink Wallet,
1550,Unisex,Sporting Goods,Sports Equipment,Footballs,White,Puma Cat Trainer-WBL Football,
10107,Men,Accessories,Watches,Watches,Steel,Fastrack Men Analogue Leather Steel Watches,
13782,Men,Apparel,Bottomwear,Trousers,Black,Belmonte Men Solid Black Trousers,
30500,Women,Apparel,Innerwear,Bra,Purple,Lovable Women Fiona Purple Bra,
3207,Women,Apparel,Topwear,Tshirts,Black,Tantra Women's Tiger Black T-shirt,
42120,Men,Apparel,Bottomwear,Shorts,Black,ADIDAS Men Black 3/4 Length Pants,
55197,Women,Personal Care,Bath and Body,Nail Essentials,Purple,Lakme Nail Colour Remover,
12650,Men,Apparel,Topwear,Tshirts,Maroon,Probase Men Printed Maroon Tshirts,
26465,Men,Apparel,Bottomwear,Shorts,Black,Puma Men Black Shorts,
47452,Women,Footwear,Shoes,Flats,Black,Tiptopp Women Black Sandals,
6775,Men,Apparel,Topwear,Tshirts,Navy Blue,Timberland Men's Tipped Pique Polo Black T-shirt,
54879,Women,Accessories,Jewellery,Necklace and Chains,Blue,Ivory Tag Women Petal Sheen Multocolour Necklace,
23117,Men,Accessories,Accessories,Accessory Gift Set,Blue,Turtle Men Formal Blue Tie, Cufflink and Pocket Square Combo Set
17322,Men,Accessories,Eyewear,Sunglasses,Brown,Pepe Jeans Men Casual Sunglasses,
51537,Women,Accessories,Watches,Watches,Silver,Fastrack Women Silver-Toned Dial Watch 9827pp06,
46580,Men,Apparel,Topwear,Tshirts,Black,ADIDAS Men Black T-shirt,
53604,Men,Accessories,Watches,Watches,Black,Q&Q Men Digital Watch M065-003,
5594,Women,Footwear,Shoes,Sports Shoes,White,ADIDAS Women's Ls Adi Ballerino White Shoe,
37341,Boys,Apparel,Topwear,Tshirts,Orange,U.S. Polo Assn. Kids Boys Orange T-shirt,
45761,Women,Personal Care,Fragrance,Deodorant,Blue,Lomani Women Cool Water Deo,
4446,Men,Footwear,Sandal,Sandals,Red,Nike Men Wilderness Black Red Sandal,
21224,Men,Apparel,Topwear,Tshirts,Brown,Basics Men Brown Printed T-shirt,
15011,Men,Apparel,Bottomwear,Track Pants,Black,ADIDAS Men Solid Black Track Pants,
38309,Men,Accessories,Scarves,Scarves,Black,Reid & Taylor Men Black Scarf,
10563,Men,Apparel,Topwear,Tshirts,Black,Puma Men Large Logo Ringer Black Tshirts,
24756,Men,Apparel,Topwear,Sweaters,Green,Spykar Men Green Sweaters,
25684,Men,Apparel,Innerwear,Innerwear Vests,White,Levis Men White Innerwear T-Shirt,
56376,Men,Personal Care,Fragrance,Perfume and Body Mist,Brown,Dunhill Men 100 ml Perfume,
32633,Women,Apparel,Bottomwear,Capris,Black,Nike Women Black Legend Slim Capris,
3663,Men,Footwear,Shoes,Sports Shoes,Black,Fila Men Walker Black Shoe,
29875,Men,Accessories,Eyewear,Sunglasses,Black,Mayhem Men Sunglasses 1021-205I,
42544,Women,Apparel,Topwear,Kurtas,Pink,Mother Earth Women Pink Kurta,
12234,Men,Apparel,Topwear,Shirts,Black,Genesis Men Check Black Shirts,
26001,Women,Personal Care,Fragrance,Perfume and Body Mist,Pink,Paris Hilton Just Me Women Perfume,
43496,Men,Apparel,Topwear,Tshirts,Navy Blue,French Connection Men Navy Blue T-shirt,
9359,Unisex,Accessories,Socks,Socks,Grey,Puma Unisex FTPA Grey Socks,
51153,Men,Accessories,Socks,Socks,Beige,Raymond Men Beige Socks,
49990,Men,Accessories,Socks,Socks,White,Hanes Men Pack Of 3 White Cushion Max Crew Socks,
29049,Men,Apparel,Topwear,Tshirts,Grey,ADIDAS Men Graphic Grey T-shirt,
35416,Men,Footwear,Shoes,Formal Shoes,Black,Enroute Men Black Formal Shoes,
47036,Women,Apparel,Topwear,Kurtas,Green,Shree Women Green & White Printed Kurta,
6311,Women,Apparel,Topwear,Tops,Black,UCB Women Basic Racerback Black Top,
23573,Men,Personal Care,Fragrance,Perfume and Body Mist,Blue,Boss Men Night Perfume,
17746,Men,Footwear,Shoes,Sports Shoes,White,Puma Men Excitmo I FG White Sports Shoe,
30958,Women,Apparel,Topwear,Tunics,Red,Fabindia Women Red Kalamkari Tunic,
12006,Men,Apparel,Topwear,Shirts,Green,Mark Taylor Men Green Striped Shirt,
26233,Men,Apparel,Topwear,Tshirts,Red,Proline Men Red Polo T-shirt,
31284,Men,Apparel,Topwear,Tshirts,Black,Puma Men Fass Black T-shirt,
3451,Men,Apparel,Topwear,Tshirts,White,ADIDAS Men's Delhi Daredevils Graphic White T-shirt,
30356,Men,Apparel,Topwear,Tshirts,Grey,Myntra Men Grey T-shirt,
54613,Men,Apparel,Innerwear,Briefs,Black,Jockey ELANCE Men Black Briefs 1010,
51361,Women,Apparel,Bottomwear,Capris,Blue,Spykar Women Blue Washed Capri,
8885,Men,Apparel,Bottomwear,Trousers,Green,Scullers Men Scul Green Trousers,
22693,Men,Footwear,Shoes,Sports Shoes,Grey,Nike Men Air Max +2009 Grey Sports Shoes,
9957,Men,Apparel,Topwear,Tshirts,White,Nike Men Arsenal Authe White T-Shirts,
47204,Men,Footwear,Shoes,Formal Shoes,Brown,Franco Leone Men Brown Formal Shoes,
6123,Men,Apparel,Topwear,Tshirts,Navy Blue,UCB Men's Solid Fabric Navy T-shirt,
37173,Boys,Apparel,Bottomwear,Shorts,Red,United Colors of Benetton Boys Knitted shorts,
38907,Girls,Apparel,Topwear,Tshirts,Red,Allen Solly Kids Girls Printed Red T-shirt,
53436,Men,Footwear,Shoes,Sports Shoes,White,ADIDAS Men White Sports Shoes,
21016,Women,Accessories,Wallets,Wallets,Purple,Fastrack Women Leather Purple Wallet,
15223,Men,Footwear,Shoes,Casual Shoes,Black,ADIDAS Originals Men ZX Casual Black Casual Shoes,
4674,Unisex,Accessories,Bags,Backpacks,Black,ADIDAS Unisex BP Clima Insp Black White Backpack,
56978,Women,Footwear,Shoes,Flats,Black,HM Women Black Sandals,
10751,Men,Apparel,Bottomwear,Track Pants,Grey,Nike Men Breakline Grey Track Pants,
57096,Women,Apparel,Bottomwear,Capris,Blue,Elle Women Blue Chambray Capris,
40021,Men,Apparel,Topwear,Tshirts,White,ADIDAS Men Grey T-shirt,
59930,Women,Apparel,Topwear,Kurtas,Multi,Diva Women Multi Coloured Kurta,
32401,Women,Apparel,Topwear,Tops,White,Arrow Woman Printed Multi Coloured Top,
56144,Women,Personal Care,Makeup,Eyeshadow,Nude,Colorbar Seductively Nude Enchanting Trio Eye Shadow,
11683,Men,Apparel,Topwear,Shirts,Grey,Lee Men Check Grey Shirts,
58218,Women,Apparel,Bottomwear,Patiala,Multi,Shree Women Multi Coloured Patiala,
14137,Men,Accessories,Cufflinks,Cufflinks,Steel,Belmonte Men Formal Steel Cufflinks,
20302,Women,Apparel,Topwear,Sweaters,Blue,Jealous 21 Women Blue Sweater,
5560,Men,Apparel,Topwear,Jackets,Green,Reebok Men Sport Revesable Black Green Jacket,
44647,Women,Apparel,Topwear,Tops,Navy Blue,Arrow Woman Navy Blue Top,
45795,Women,Footwear,Shoes,Heels,Black,Senorita Women Black Sandals,
36267,Women,Apparel,Loungewear and Nightwear,Night suits,Blue,SDL by Sweet Dreams Women Blue Night suits,
33715,Women,Apparel,Bottomwear,Jeggings,Blue,Pieces Women Blue Jeggings,
10597,Men,Apparel,Bottomwear,Jeans,Blue,Flying Machine Men Skinny Jack Blue Jeans,
25670,Men,Accessories,Watches,Watches,Silver,Fastrack Men Silver-Toned Dial Watch NE3039SM01,
11445,Women,Apparel,Topwear,Tops,White,United Colors of Benetton Women  Winter White Printed Top,
3697,Women,Apparel,Topwear,Tshirts,Pink,Tantra Women Cool Pink Long T-shirt,
49158,Women,Personal Care,Makeup,Foundation and Primer,Skin,Deborah Fair Colour Copy Mat Effect 0 Foundation,
29881,Men,Accessories,Eyewear,Sunglasses,Black,Mayhem Men Aviator Sunglasses 1019-204,
19628,Men,Apparel,Topwear,Tshirts,Black,United Colors of Benetton Men Printed Black Tshirt,
55507,Women,Personal Care,Lips,Lip Gloss,Rose,Revlon Glossy Rose Lustrous Lip Gloss 16,
13312,Men,Apparel,Topwear,Shirts,Navy Blue,Gini and Jony Kids Boys Solid Navy Blue Shirts,
28953,Women,Apparel,Topwear,Kurtis,Yellow,BIBA OUTLET Women Yellow Kurti,
43462,Women,Apparel,Loungewear and Nightwear,Night suits,White,SDL by Sweet Dreams Women White Night suits,
2745,Men,Apparel,Topwear,Tshirts,Black,Classic Polo Men's Black T-shirt,
50849,Women,Accessories,Stoles,Stoles,Blue,Fabindia Women Blue Stole,
30190,Unisex,Accessories,Bags,Backpacks,Red,Nike Unisex Nylon Red Backpack,
49964,Men,Apparel,Topwear,Tshirts,Grey Melange,Hanes Men Grey Melange Pack of 3 T-shirts,
7237,Men,Footwear,Shoes,Formal Shoes,Beige,Rockport Men's Slate Taupe Fabric Shoe,
46110,Men,Footwear,Flip Flops,Flip Flops,Grey,ADIDAS Men Grey Flip Flops,
23587,Women,Personal Care,Fragrance,Deodorant,Blue,Nike Fragrances Women  Up or Down Deo,
31270,Men,Apparel,Topwear,Tshirts,Navy Blue,Puma Men Hamburg Graphic Navy Blue T-shirt,
43650,Women,Apparel,Topwear,Tops,Black,ONLY Women Blue Top,
2577,Women,Apparel,Topwear,Tops,White,Domyos Women White Sports Top,
27315,Women,Personal Care,Fragrance,Fragrance Gift Set,Purple,ADIDAS Women Natural Vitality Pack of 2 Fragrance Gift Set,
