id,gender,masterCategory,subCategory,articleType,baseColour,productDisplayName,
47054,Women,Apparel,Bottomwear,Salwar,Brown,Shree Women Brown & Green Jodhpuri Salwar,
6373,Women,Footwear,Shoes,Casual Shoes,Black,Puma Women's Supersuede Black Shoe,
35474,Women,Footwear,Shoes,Heels,Blue,Catwalk Women Ruffles Blue Flats,
30106,Men,Apparel,Topwear,Shirts,Navy Blue,Flying Machine Men Navy Blue Shirt,
47868,Women,Accessories,Bags,Handbags,Mauve,Murcia Women Mauve Handbag,
13384,Men,Footwear,Shoes,Casual Shoes,Brown,Timberland Men Toddler Brown Casual Shoes,
55591,Men,Apparel,Topwear,Shirts,Black,Peter England Men Black Shirt,
26063,Men,Apparel,Topwear,Shirts,Blue,John Miller Men Striped Blue Shirt,
3601,Unisex,Apparel,Topwear,Tshirts,Blue,Puma Deccan Chargers Kids Navy Blue Lookalike Jersey,
1532,Men,Apparel,Topwear,Tshirts,Grey,Puma Men Grey Leaping Cat T-shirt,
40615,Women,Apparel,Topwear,Kurtas,Green,Span Women Teal Kurta,
32235,Women,Apparel,Topwear,Kurtas,Blue,Fabindia Women Printed Blue Kurta,
25282,Women,Accessories,Bags,Handbags,Brown,Lino Perros Women Brown and Red Handbag,
56770,Men,Apparel,Topwear,Shirts,Grey,Horsefly Men Grey & Blue Striped Shirt,
37747,Men,Apparel,Topwear,Shirts,Khaki,John Players Men Khaki Shirt,
5192,Men,Apparel,Topwear,Tshirts,Navy Blue,DC Comics Men's Superman Eagle Navy T-shirt,
21622,Women,Apparel,Innerwear,Bra,Pink,Enamor Women Pink Bra,
15417,Women,Footwear,Shoes,Sports Shoes,White,FILA Women Tenet White Sports Shoes,
45367,Women,Footwear,Shoes,Heels,Red,Cobblerz Women Red Sandals,
36695,Men,Personal Care,Fragrance,Perfume and Body Mist,Brown,Dolce & Gabbana Men The One Perfume,
4040,Men,Apparel,Topwear,Tshirts,Blue,Rajasthan Royals Mens Replica Cotton Jersey,
35010,Women,Accessories,Stoles,Stoles,Beige,Fabindia Women Printed Beige & Rust Stole,
16292,Men,Apparel,Topwear,Tshirts,Navy Blue,Peter England Men Stripes Navy Blue Polo T-Shirt,
51555,Men,Accessories,Watches,Watches,Blue,Fastrack Men Blue Dial Watch,
23175,Men,Apparel,Topwear,Tshirts,Navy Blue,Mark Taylor Men Navy Blue Printed T-shirt,
50487,Men,Apparel,Innerwear,Trunk,Red,Chromozome Men Red Trunk Trunks,
47430,Women,Accessories,Bags,Handbags,Brown,Baggit Women Brown Handbag,
6717,Men,Apparel,Topwear,Tshirts,Blue,Locomotive Men's Ribbed Neck Blue T-shirt,
12632,Men,Apparel,Topwear,Tshirts,Grey,Probase Men Printed Grey Tshirts,
3265,Men,Apparel,Topwear,Tshirts,Blue,Guerrilla Men's Kill You Blue T-shirt,
42142,Men,Footwear,Shoes,Sports Shoes,White,Nike Men White Zoom Vomero Sports Shoes,
48478,Women,Apparel,Dress,Dresses,Beige,French Connection Women Beige Dress,
30562,Men,Accessories,Eyewear,Sunglasses,Steel,Opium Men Aviator Steel Sunglasses,
18308,Men,Apparel,Topwear,Tshirts,Green,Wills Lifestyle Men Striped Green T-shirt,
51767,Men,Accessories,Belts,Belts,Black,Hidedge Men Black Belt,
22295,Women,Footwear,Shoes,Heels,Black,Inc. 5 Women Casual Black Flats,
47602,Women,Footwear,Shoes,Flats,Brown,Portia Women Yellow Flats,
18906,Men,Footwear,Shoes,Sports Shoes,White,ADIDAS Men J-RUN III White Sports Shoes,
6525,Women,Apparel,Bottomwear,Shorts,Yellow,Nike Women's Tempo yellow Short,
17172,Men,Apparel,Topwear,Shirts,Blue,U.S. Polo Assn. Men Checks Blue Shirt,
3057,Men,Apparel,Topwear,Tshirts,Green,Tantra Men Cut The Crap Green T-shirt,
49798,Men,Accessories,Headwear,Caps,Green,Flying Machine Men Green Cap,
12400,Men,Accessories,Socks,Socks,Beige,Reid & Taylor Men Solid Beige Socks,
26635,Men,Footwear,Shoes,Casual Shoes,Black,Puma Men Future Cat Black Casual Shoes,
2185,Men,Apparel,Topwear,Tshirts,Yellow,Probase Mens Shut Up Yellow Tee T-shirt,
30750,Men,Apparel,Topwear,Kurtas,White,Fabindia Men White Striped Khadi Kurta,
40427,Women,Apparel,Dress,Jumpsuit,Olive,Tonga Women Beige Jumpsuit,
10357,Men,Apparel,Topwear,Tshirts,Maroon,United Colors of Benetton Men Maroon Polo Tshirt,
57490,Men,Footwear,Shoes,Casual Shoes,Black,Lee Cooper Men Black  Shoes,
24162,Women,Apparel,Topwear,Kurtas,White,Aurelia Women White Kurta,
45969,Women,Apparel,Topwear,Tops,Grey Melange,Tokyo Talkies Women Grey Melange Printed Top,
56542,Women,Personal Care,Eyes,Mascara,Black,Streetwear Wonder Lash Mascara,
11285,Men,Apparel,Bottomwear,Jeans,Blue,Wrangler Men Blue Texas Jeans,
32007,Men,Accessories,Socks,Socks,Black,Playboy Men Black and Blue Socks,
53030,Women,Apparel,Saree,Sarees,Multi,FNF Multi Coloured Printed Sari,
37575,Girls,Apparel,Socks,Booties,Green,Madagascar 3 Infant Girls Light Green Booties,
45155,Men,Accessories,Watches,Watches,Black,CASIO ENTICER Men Black Dial Analogue Watch A499,
4272,Men,Footwear,Shoes,Formal Shoes,Black,Rockport Men's Aderner Black Shoe,
21410,Men,Apparel,Topwear,Tshirts,Black,Locomotive Men Printed Black T-shirt,
15625,Men,Apparel,Topwear,Sweatshirts,Grey,Nike Men AS Squad FT LS Crew Grey Sweatshirts,
57656,Women,Personal Care,Nails,Nail Polish,Pink,Lotus Herbals Make-Up Colour Dew Candy Drop Nail Enamel 92,
33313,Men,Apparel,Topwear,Tshirts,Off White,Jack & Jones Men Off White T-shirt,
41733,Women,Footwear,Shoes,Heels,Grey,Catwalk Women Grey Flats,
39629,Men,Footwear,Shoes,Casual Shoes,Purple,Nike Men Toki Premium Purple Casual Shoes,
25276,Women,Accessories,Bags,Handbags,Red,Lino Perros Women Leatherite Red Handbag,
4888,Women,Apparel,Topwear,Tops,White,Levis Kids Girl's Dionne White Teens Kidswear,
11043,Men,Apparel,Topwear,Shirts,White,Scullers Men Check White Shirts,
5166,Men,Apparel,Topwear,Tshirts,Black,Ed Hardy Men's Special Ops Bull Dog Black T-shirt,
14531,Men,Apparel,Topwear,Tshirts,Green,Mark Taylor Men Printed Green Tshirts,
20704,Men,Footwear,Shoes,Casual Shoes,Black,Buckaroo Men Marcela Black Casual Shoes,
52324,Women,Accessories,Jewellery,Bangle,Black,ToniQ Women Black Bangle,
45393,Women,Footwear,Shoes,Flats,Maroon,Rocia Women Maroon Sandals,
7631,Men,Apparel,Bottomwear,Shorts,Navy Blue,Puma Men's Woven Navy Short,
46516,Men,Accessories,Watches,Watches,Blue,Timex Men Blue Dial Watch,
22053,Women,Apparel,Topwear,Kurtas,Purple,Vishudh Women Printed Purple Kurta,
23181,Men,Apparel,Topwear,Shirts,Red,Black Coffee Men Red Check Shirt,
43858,Women,Accessories,Jewellery,Earrings,Green,Royal Diadem Green Earrings,
28569,Men,Apparel,Topwear,Tshirts,Purple,Nike Men Verbiage Purple T-shirt,
50473,Men,Apparel,Innerwear,Briefs,Red,Chromozome Men Red & Black Brief,
34136,Men,Accessories,Wallets,Wallets,Black,Turtle Men Leather Black Wallet,
55101,Women,Personal Care,Skin Care,Face Moisturisers,Silver,Ponds Age Miracle Cell ReGen Day Cream SPF 15 35g,
31444,Men,Apparel,Topwear,Tshirts,Blue,Nike Men Football Blue Jersey,
8679,Unisex,Accessories,Eyewear,Sunglasses,Black,Fastrack Unisex Black Sunglasses,
3291,Men,Apparel,Topwear,Tshirts,Brown,Guerrilla Men's Warrior Brown T-shirt,
43064,Men,Apparel,Topwear,Tshirts,Black,Nike Men Black Dutch T-shirt,
30596,Men,Apparel,Bottomwear,Shorts,Blue,Nike Men Woven Blue Shorts,
2343,Men,Apparel,Topwear,Tshirts,Green,Reebok Men Basil Green & Blue Polo T-shirt,
27521,Women,Footwear,Shoes,Heels,White,Catwalk Women White Heels,
13714,Men,Apparel,Topwear,Sweaters,Black,Proline Black Sleeveless Sweater,
16054,Men,Apparel,Bottomwear,Trousers,Grey,Highlander Men Solid Grey Trouser,
22261,Women,Footwear,Shoes,Heels,Multi,Inc.5 Women Multi Casual Flats,
29689,Men,Apparel,Bottomwear,Shorts,Blue,Indigo Nation Men Check Blue Shorts,
7403,Men,Footwear,Shoes,Casual Shoes,Brown,Red Tape Men Slip-On Brown Shoes,
19820,Men,Apparel,Topwear,Sweaters,Green,U.S. Polo Assn. Men Solid Green Sweater,
46724,Women,Personal Care,Fragrance,Perfume and Body Mist,Blue,Rasasi Women Temptation Perfume,
34304,Women,Accessories,Stoles,Stoles,Off White,Fabindia Women Off White Stole,
17186,Men,Apparel,Topwear,Shirts,Maroon,U.S. Polo Assn. Men Checks Maroon Shirt,
50641,Men,Apparel,Innerwear,Innerwear Vests,Grey,Chromozome Men Grey Innerwear Vest,
16868,Men,Accessories,Eyewear,Sunglasses,Brown,Idee Men Funky Eyewear Brown Sunglasses,
55333,Women,Personal Care,Hair,Hair Colour,Burgundy,Revlon Colorsilk 3DB Deep Burgundy Hair Colour,
43256,Women,Apparel,Topwear,Kurtas,Pink,Aneri Women Salmon Pink Kurta,
9599,Men,Apparel,Topwear,Shirts,Navy Blue,Scullers Men Navy Blue Shirts,
2171,Men,Apparel,Topwear,Tshirts,Brown,Probase Men Brown & White T-shirt,
33121,Women,Footwear,Shoes,Heels,Blue,Catwalk Women Blue Flats,
25044,Women,Apparel,Topwear,Tshirts,Pink,Nike Women Smash Pink T-shirt,
14703,Men,Apparel,Topwear,Shirts,Grey,Genesis Men Stripes Grey Shirts,
20536,Women,Accessories,Belts,Belts,Blue,Baggit Women Flora Astro Blue Belt,
5354,Men,Footwear,Shoes,Sports Shoes,Grey,Kalenji Ekiden 50 Wht/grey 09,
37581,Girls,Apparel,Bottomwear,Shorts,Green,Madagascar 3 Girls Light Green Shorts,
44073,Men,Personal Care,Fragrance,Perfume and Body Mist,Grey,Hugo XY Men Summer Edition 100 ml Perfume,
25878,Unisex,Accessories,Bags,Backpacks,Black,American Tourister Unisex Citi Pro Black Backpack,
4286,Men,Footwear,Shoes,Casual Shoes,Grey,Rockport Men Cashaw Grey Shoe,
36453,Men,Footwear,Shoes,Sports Shoes,Black,Spinn Men Techno Black Sports Shoes,
52116,Women,Apparel,Topwear,Tops,White,Myntra Women White Printed Top,
47292,Women,Accessories,Bags,Handbags,Purple,Baggit Women Purple Handbag,
34760,Women,Accessories,Bags,Handbags,Lime Green,Be For Bag Women  Lime Green Tote Bag,
50225,Women,Accessories,Belts,Belts,Brown,Stoln Women Brown Belt,
16430,Men,Apparel,Topwear,Tshirts,Blue,Levi's Men Printed Blue  Tshirts,
8813,Men,Apparel,Topwear,Shirts,Purple,Spykar Men Ranger Black & Purple Check Shirt,
22605,Unisex,Accessories,Headwear,Caps,Blue,Nike Unisex India Stadium Blue Cap,
7067,Unisex,Accessories,Bags,Backpacks,Grey,Nike Unisex All Access SO Grey Backpack,
27377,Men,Apparel,Topwear,Tshirts,Beige,Tantra Men Jimmo Beige T-shirt,
54685,Women,Apparel,Topwear,Kurtas,Pink,Shree Women Pink Printed Kurta,
43632,Women,Apparel,Dress,Dresses,Black,Vero Moda Women Black Dress,
31212,Men,Footwear,Shoes,Sports Shoes,Black,Lotto Men Dunk Hi Black Sports Shoes,
49308,Men,Accessories,Socks,Socks,Black,Arrow Men Pack Of 5 Basic Plating Socks,
12090,Women,Apparel,Topwear,Kurtas,Cream,W Women Printed Cream Kurtas,
19478,Men,Accessories,Socks,Socks,Blue,Quiksilver Men High Blue Socks,
25420,Men,Footwear,Shoes,Casual Shoes,Black,Nike Men Lite Force Black & White Shoes,
11615,Women,Apparel,Topwear,Kurtas,Green,W Women Solid Green Kurtas,
32497,Men,Footwear,Shoes,Casual Shoes,Grey,Converse Men CT AS 17 NYC Grey Shoes,
58874,Men,Accessories,Ties,Ties,Navy Blue,Hakashi Men Navy Blue Tie,
57000,Women,Footwear,Shoes,Flats,White,HM Women White Sandals,
36037,Unisex,Accessories,Bags,Handbags,Beige,OTLS Unisex Beige Bag,
41959,Boys,Apparel,Topwear,Tshirts,Green,Gini and Jony Boys Rugby Green T-shirt,
39843,Boys,Apparel,Topwear,Tshirts,Navy Blue,Gini and Jony Boys Printed Dark Navy T-Shirt,
14367,Women,Footwear,Shoes,Heels,Brown,Catwalk Women Casual Brown Flats,
38991,Boys,Apparel,Topwear,Tshirts,White,Gini and Jony Boys Rodeo T-shirt,
20152,Men,Apparel,Topwear,Shirts,Red,Wrangler Men Willy Rodeo Red Shirt,
5730,Men,Footwear,Shoes,Sports Shoes,White,Reebok Men's Hex Run White Shoe,
44417,Men,Footwear,Shoes,Formal Shoes,Black,Red Tape Men Black Formal Shoes,
41357,Men,Apparel,Bottomwear,Jeans,NA,Wrangler Men Blue Millard Jeans,
25612,Women,Accessories,Watches,Watches,Black,Fastrack Women Black Watch,
11427,Women,Apparel,Topwear,Tops,Purple,United Colors of Benetton Women Light Winter Purple Tops,
14969,Men,Accessories,Wallets,Wallets,Brown,Newhide Smooth Finish Wallet,
33777,Unisex,Accessories,Socks,Socks,White,Puma Unisex Retro Pack of 2 Socks,
40285,Unisex,Footwear,Sandal,Sandals,Green,Warner Bros kids Unisex Green Sandals,
15087,Men,Apparel,Topwear,Shirts,Black,Mother Earth Men Solid Black Shirts,
36205,Boys,Apparel,Topwear,Shirts,White,Gini Jony Boys White Shirt,
5502,Men,Apparel,Topwear,Tshirts,Blue,Mr.Men Men's Mischief Placid Blue T-shirt,
44625,Men,Apparel,Bottomwear,Shorts,Black,Nike Men Black Shorts,
53692,Women,Accessories,Bags,Handbags,Beige,Kiara Women Beige Handbag,
20360,Men,Apparel,Topwear,Tshirts,Blue,Spykar Men Stripes Blue T-Shirt,
50017,Men,Apparel,Innerwear,Innerwear Vests,White,Hanes Men White DuoDry Body Fit V-Neck T-shirt,
27979,Men,Apparel,Innerwear,Briefs,White,Jockey ZONE STRETCH Men Zone Stretch White Brief US07,
6387,Men,Footwear,Shoes,Sports Shoes,Navy Blue,Puma Men's Trim Mesh Navy White Shoe,
34552,Women,Accessories,Bags,Handbags,Red,Puma Women Originals Mono Red Handbag,
7255,Men,Footwear,Shoes,Sports Shoes,Grey,Rockport Men's Hydro Sail Light Grey Red Shoe,
16602,Women,Apparel,Topwear,Shirts,Black,Scullers Women Check Black Shirt,
49906,Unisex,Accessories,Watches,Watches,Yellow,Q&Q Kids Unisex Yellow Dial Analog Watch,
28931,Men,Apparel,Topwear,Tshirts,Purple,Mr. Men Printed Purple T-shirt,
43400,Men,Accessories,Socks,Socks,Multi,Lino Perros Men Monday to Friday Socks,
2727,Boys,Apparel,Topwear,Tshirts,Yellow,Disney Kids Boy's Yellow Polo Tshirt,
27145,Women,Apparel,Innerwear,Bra,White,Miss-T White Bra,
13370,Men,Footwear,Shoes,Casual Shoes,Grey,Timberland Men Jeunes Grey Casual Shoes,
18798,Unisex,Accessories,Bags,Handbags,Beige,Peter England Unisex Casual Beige Bag,
55565,Women,Personal Care,Fragrance,Deodorant,Red,Revlon Women Deo,
31020,Men,Apparel,Topwear,Tshirts,Green,Arrow New York Men Green T-shirt,
40418,Women,Apparel,Topwear,Tops,Black,Tonga Women Black Top,
53833,Women,Apparel,Topwear,Kurtas,Yellow,Vishudh Women Yellow Printed Kurta,
38502,Girls,Apparel,Bottomwear,Shorts,Navy Blue,Gini and Jony Girls Woven Navy Blue Shorts,
44884,Men,Apparel,Topwear,Tshirts,Black,Puma Men Black Striped Polo neck T-shirt,
32038,Men,Accessories,Socks,Socks,Grey,Playboy Men Grey and Black  Socks,
36498,Women,Apparel,Topwear,Kurtas,Green,Folklore Women Green Kurta,
32804,Women,Footwear,Shoes,Heels,Purple,iPanema Women Ritmos Purple Heels,
59535,Women,Accessories,Jewellery,Earrings,Silver,Lucera Silver Earrings,
29642,Men,Apparel,Topwear,Shirts,Black,Indigo Nation Men Black Shirt,
3854,Girls,Apparel,Topwear,Tshirts,Pink,Disney Kids Girl's Pink Minnie Sunshine Kidswear,
51758,Women,Footwear,Shoes,Heels,Black,Catwalk Women Black Peep Toes,
18939,Men,Apparel,Topwear,Tshirts,Black,Levi's Men Graphic Black Tshirt,
2986,Men,Apparel,Topwear,Tshirts,Green,Puma Men's Splatter Green T-shirt,
28790,Men,Apparel,Bottomwear,Jeans,Blue,Denizen Men Blue Jeans,
8480,Women,Apparel,Dress,Dresses,Cream,Forever New Women Magnolia Cream Dress,
3068,Women,Apparel,Topwear,Tshirts,Yellow,Tantra Women's Hint Lime Green T-shirt,
9552,Men,Apparel,Topwear,Tshirts,Red,Nike Men As Race Day Ss Red T-Shirts,
17971,Men,Footwear,Sandal,Sandals,Black,Puma Men Rio Black Sandal,
48675,Women,Accessories,Jewellery,Earrings,Silver,Lucera Women Silver Earrings,
42941,Men,Accessories,Belts,Belts,Brown,French Connection Men Brown Belts,
22098,Men,Footwear,Shoes,Casual Shoes,Navy Blue,Numero Uno Men Casual Navy Blue Shoes,
29470,Men,Accessories,Watches,Watches,Silver,GIORDANO Men Silver-Toned Dial Watch 1575-02,
43893,Unisex,Footwear,Shoes,Casual Shoes,Black,Puma Unisex Black Shoes,
6728,Women,Footwear,Shoes,Sports Shoes,White,Puma Women Faas 300 White Silver Purple Shoe,
26438,Women,Accessories,Bags,Handbags,Blue,Spice Art Women Beaded Bow Blue Handbag,
35813,Women,Footwear,Shoes,Heels,Black,Enroute Women Black Heels,
49595,Women,Footwear,Shoes,Heels,Multi,Catwalk Women Multi Coloured Flats,
9760,Men,Apparel,Topwear,Tshirts,Green,Classic Polo Men Green Polo Tshirts,
2388,Men,Footwear,Shoes,Casual Shoes,Brown,Red Tape Men Brown Casual Shoe,
23976,Men,Apparel,Topwear,Shirts,Blue,Peter England Men Blue Striped Shirt,
48447,Men,Apparel,Topwear,Tshirts,White,French Connection Men White T-shirt,
54018,Women,Accessories,Bags,Handbags,Teal,Kiara Women Teal Handbag,
5991,Men,Apparel,Topwear,Shirts,Green,Highlander Men Black Green Checked Slim Fit Shirt,
11088,Men,Apparel,Topwear,Shirts,Green,Scullers Men Check Green Shirts,
4843,Women,Apparel,Topwear,Tshirts,Black,Sher Singh Women's Black Polo T-shirt,
37778,Men,Apparel,Topwear,Shirts,Beige,John Players Men Pink & Beige Shirt,
59707,Women,Apparel,Innerwear,Briefs,Black,Avirate Black Brief,
45358,Women,Footwear,Shoes,Heels,Brown,Cobblerz Women Brown Sandals,
30905,Women,Apparel,Bottomwear,Salwar,Maroon,Fabindia Women Maroon Salwar,
34599,Women,Apparel,Dress,Dresses,Black,Tonga Women Printed Black Dress,
26860,Men,Personal Care,Fragrance,Perfume and Body Mist,Blue,Davidoff Men Cool Water Perfume,
29014,Men,Apparel,Topwear,Tshirts,Grey,ADIDAS Men  Grey Polo T-shirt,
30139,Women,Apparel,Topwear,Tshirts,Green,Flying Machine Women Printed Green T-shirt,
48023,Women,Accessories,Watches,Watches,Orange,Helix Women Orange Dial Watch,
18753,Women,Apparel,Topwear,Tops,Blue,Arrow Woman Megan Blue Top,
47857,Women,Accessories,Bags,Handbags,Charcoal,Murcia Women Charcoal Handbag,
46985,Women,Accessories,Bags,Handbags,Black,Bulchee Women Black Handbag,
19681,Women,Apparel,Topwear,Tops,Olive,United Colors of Benetton Women Solid Olive Top,
42519,Men,Apparel,Topwear,Shirts,White,Mother Earth Men White Shirt,
51932,Women,Accessories,Bags,Handbags,Black,Nyk Women Black Vespa Handbag,
15870,Unisex,Footwear,Shoes,Casual Shoes,Blue,Warner Bros Kids Unisex TJ Notebook Canvas Blue Casual Shoes,
39286,Men,Footwear,Sandal,Sandals,Tan,Red Chief Men Tan Sandals,
59363,Women,Apparel,Topwear,Kurtas,Red,Vishudh Women Red & Grey Kurta,
21279,Women,Accessories,Eyewear,Sunglasses,Black,Allen Solly Women Sunglasses AS166-C1,
53659,Women,Accessories,Bags,Handbags,Grey,Kiara Women Grey & Brown Handbag,
56119,Women,Personal Care,Lips,Lip Gloss,Brown,Colorbar Toffee Tango Lip Pot 005,
21877,Women,Apparel,Topwear,Kurtas,Blue,BIBA Women Sliver Stripes Blue Kurta,
38166,Women,Accessories,Eyewear,Sunglasses,White,Miami Blues Women Sunglasses,
24539,Women,Apparel,Topwear,Kurtis,Red,Mother Earth Women Red  Printed Kurti,
37912,Women,Apparel,Dress,Dresses,Orange,Mineral Women Floral Orange Dress,
56925,Women,Footwear,Shoes,Heels,Multi,HM Women Multi Coloured Flats,
39888,Women,Footwear,Shoes,Sports Shoes,White,ADIDAS Women White Core 50 Sports Shoes,
41992,Boys,Apparel,Bottomwear,Shorts,Black,Gini and Jony Boys Customised Black Shorts,
20199,Men,Apparel,Topwear,Sweatshirts,Navy Blue,Wrangler Men Falcon Navy Sweatshirt,
47259,Men,Apparel,Innerwear,Briefs,Grey Melange,FCUK Underwear Men Grey Brief,
17529,Unisex,Accessories,Headwear,Caps,Black,ADIDAS Unisex Sports Black Caps,
29226,Men,Footwear,Flip Flops,Flip Flops,Black,ADIDAS Men Zeitfrei Slide Black Flip Flops,
12867,Men,Footwear,Shoes,Casual Shoes,Black,Lee Cooper Men Casual Black Shoes,
35679,Men,Footwear,Shoes,Casual Shoes,Navy Blue,U.S. Polo Assn. Men Navy Blue Shoes,
13189,Men,Footwear,Shoes,Sports Shoes,Black,Fila Men Dls Nitrous Black Sports Shoes,
18561,Women,Footwear,Shoes,Casual Shoes,Blue,Catwalk Women  Blue Casual Shoe,
9136,Men,Footwear,Shoes,Sports Shoes,Black,Puma Men Iknois 2 XT Black Sports Shoes,
48211,Men,Accessories,Eyewear,Sunglasses,Brown,United Colors of Benetton Men Brown Sunglasses,
7890,Men,Apparel,Bottomwear,Track Pants,Brown,Proline Men Brown Track Pants,
50028,Women,Apparel,Loungewear and Nightwear,Lounge Shorts,Black,Hanes Women Assorted Lounge Shorts,
28132,Men,Apparel,Innerwear,Briefs,White,Jockey Modern Classic Men Pack of 2 White POCO Briefs 8035,
27946,Men,Apparel,Innerwear,Trunk,Black,Jockey CSM Men Comfort Stretch Black Trunks CS04,
26894,Women,Apparel,Topwear,Tops,White,Jealous 21 Women Printed White Top,
49939,Men,Apparel,Topwear,Tshirts,Grey,Hanes Men Grey T-shirt,
31823,Men,Accessories,Watches,Watches,Steel,Titan Men White Dial Watch,
2718,Girls,Apparel,Topwear,Tops,Red,Disney Kids Girl's Red Pooh Kidswear,
54488,Women,Accessories,Bags,Handbags,Green,Lino Perros Women Green Sling Bag,
46971,Women,Accessories,Bags,Handbags,Purple,Bulchee Women Wine Handbag,
19675,Women,Apparel,Topwear,Tshirts,White,United Colors of Benetton Women Printed White T-shirt,
49105,Women,Personal Care,Makeup,Kajal and Eyeliner,Black,Deborah Precisione Waterproof Black Eye Liner,
8222,Men,Accessories,Bags,Backpacks,Red,Fastrack Men Red Nylon Backpack,
39272,Men,Footwear,Shoes,Casual Shoes,Olive,Red Chief Men Olive Shoes,
15884,Unisex,Footwear,Shoes,Casual Shoes,Brown,Warner Bros Kids Unisex TJ Chase Casual Brown Casual Shoes,
11418,Men,Apparel,Topwear,Tshirts,Black,United Colors of Benetton Men Light Winter Black Tshirts,
14956,Men,Apparel,Topwear,Tshirts,White,Status Quo Men Printed White Tshirts,
33748,Women,Apparel,Topwear,Tunics,Black,Vero Moda Women Black Tunic,
58245,Women,Accessories,Wallets,Wallets,Brown,Baggit Women Brown Wallet,
36834,Men,Footwear,Flip Flops,Flip Flops,Brown,Nike Men Sidewinder Brown Flip Flops,
39040,Men,Accessories,Cufflinks,Cufflinks,Gold,Belmonte Men Golden Bright Assorted Cufflinks,
59999,Women,Footwear,Shoes,Heels,Bronze,Catwalk Women Bronze Wedges,
21883,Women,Apparel,Topwear,Kurtas,Pink,BIBA Women Printed Pink Kurta,
20951,Men,Footwear,Sandal,Sandals,Red,ADIDAS Men Plugged In Red Slipper,
38192,Men,Accessories,Eyewear,Sunglasses,Grey,Polaroid Men Sunglasses,
41966,Boys,Apparel,Topwear,Tshirts,Black,Gini and Jony Boys Surfs Up Black T-shirt,
14358,Women,Footwear,Shoes,Heels,Brown,Catwalk Women Casual Brown Heels,
44428,Men,Footwear,Shoes,Formal Shoes,Black,Gliders Men Black Formal Shoes,
57803,Women,Personal Care,Makeup,Highlighter and Blush,Beige,Lotus Herbals Natural Blend Raspberry Punch Blusher 603,
13941,Men,Apparel,Topwear,Shirts,Blue,United Colors of Benetton Men Solid Blue Shirts,
28300,Men,Accessories,Eyewear,Sunglasses,Copper,Fastrack Men Copper Sunglasses,
7058,Unisex,Accessories,Bags,Backpacks,Black,Nike Unisex Manchester Black Backpack,
12893,Men,Footwear,Shoes,Formal Shoes,Brown,Hush Puppies Men Jungle Brown Formal Shoes,
18595,Men,Accessories,Wallets,Wallets,Black,New Hide Men Casual Black Wallet,
27348,Women,Apparel,Topwear,Tshirts,White,Tantra Women 3G White T-shirt,
7864,Men,Footwear,Shoes,Formal Shoes,Brown,Provogue Men's Formal Brown Shoe,
44870,Men,Apparel,Bottomwear,Shorts,Red,Puma Men Red Foundation Beach Shorts,
52915,Women,Apparel,Saree,Sarees,White,FNF Women Printed White Sari,
39424,Men,Apparel,Topwear,Tshirts,Red,U.S. Polo Assn. Denim Co. Men Red Polo T-Shirt,
20509,Women,Accessories,Bags,Handbags,Teal,Baggit Women Varsh Taj Teal Handbag,
33922,Women,Accessories,Watches,Watches,Blue,Citizen Women Blue Dial Watch,
24995,Boys,Apparel,Bottomwear,Jeans,Blue,United Colors of Benetton Boys Boys Blue Washed Jeans,
25847,Women,Apparel,Topwear,Kurtis,Pink,Diva Women Printed Pink Kurti,
52129,Boys,Apparel,Topwear,Tshirts,White,Doodle Boys white Printed T-Shirt,
2972,Men,Apparel,Topwear,Tshirts,White,Puma Men's Sless White T-shirt,
28764,Women,Apparel,Topwear,Kurtas,Beige,Aurelia Women Beige Kurta,
49753,Men,Accessories,Ties,Ties,Black,Parx Men Black and White Tie,
16857,Women,Accessories,Eyewear,Sunglasses,Black,Idee Women Funky Eyewear Black Sunglasses,
31649,Men,Apparel,Topwear,Shirts,Blue,Indigo Nation Men Striped Blue Shirt,
8474,Women,Apparel,Topwear,Shirts,Black,Scullers For Her Women Scarf Shirt Black Tops,
19023,Women,Footwear,Shoes,Heels,Silver,Catwalk Women Sequins Sliver Heels,
13519,Men,Apparel,Topwear,Sweatshirts,White,Spykar Men Stripes White Sweatshirts,
17985,Unisex,Accessories,Bags,Backpacks,Grey,U.S. Polo Assn. Unisex Laptop Grey Backpack,
43269,Women,Apparel,Topwear,Kurtas,Pink,Aneri Women Pink Kurta,
48681,Women,Accessories,Jewellery,Earrings,Gold,Lucera Women Gold Earrings,
46529,Men,Accessories,Watches,Watches,Silver,Timex Men Silver Toned Dial Watch,
55902,Women,Personal Care,Nails,Nail Polish,Pink,Colorbar Beautiful Pink Nail Lacquer 16,
43867,Women,Accessories,Jewellery,Earrings,White,Royal Diadem White Earrings,
28556,Men,Apparel,Topwear,Tshirts,Black,Nike Men Club Polo Black T-shirt,
34109,Girls,Apparel,Topwear,Tops,Blue,Doodle Girls Printed Blue Top,
19211,Men,Accessories,Belts,Belts,Brown,United Colors of Benetton Men Solid Brown Belt,
22850,Men,Footwear,Shoes,Casual Shoes,Brown,Woodland Men Brown Casual Shoes,
49561,Women,Accessories,Bags,Clutches,Black,Spice Art Women Black Clutch,
8646,Men,Accessories,Eyewear,Sunglasses,Yellow,Fastrack Men Sports Sunglasses P148AM3,
9794,Unisex,Accessories,Bags,Backpacks,Green,ADIDAS Unisex NBA eltics Backpack Green Backpacks,
23982,Men,Apparel,Topwear,Shirts,White,Peter England Men White Striped Shirt,
34935,Women,Apparel,Topwear,Dupatta,Purple,Fabindia Purple Dupatta,
57669,Women,Personal Care,Nails,Nail Polish,Red,Lotus Herbals Colour Dew Rouge Pulp Nail Polish 911,
39616,Women,Footwear,Shoes,Casual Shoes,Yellow,Catwalk Women Yellow Shoes,
25249,Women,Accessories,Bags,Handbags,Brown,Lino Perros Women Leatherette Brown Handbag,
10992,Men,Apparel,Topwear,Tshirts,Purple,Inkfruit Men Dust Rider Purple Tshirts,
58621,Women,Accessories,Jewellery,Earrings,Multi,ToniQ Women Multi Coloured Earrings,
11840,Men,Footwear,Shoes,Casual Shoes,Beige,Playboy Men Casual Beige Casual Shoes,
58681,Women,Apparel,Topwear,Kurtas,Black,ALayna Women Black Kurta,
53269,Men,Apparel,Topwear,Shirts,White,Locomotive Men White Shirt,
59753,Women,Apparel,Innerwear,Briefs,White,Avirate White Brief,
1559,Unisex,Accessories,Bags,Backpacks,Blue,Quechua Blue Light Backpack,
4817,Men,Apparel,Topwear,Tshirts,Black,ADIDAS Men's AP ST Black T-shirt,
42129,Men,Footwear,Shoes,Sports Shoes,Black,Nike Men Black Air Visi Pro Sports Shoes,
12659,Men,Apparel,Topwear,Shirts,White,Probase Men Stripes White Shirts,
34995,Women,Apparel,Saree,Sarees,Green,Fabindia Women H& Printed Green Sari,
18363,Men,Footwear,Shoes,Casual Shoes,White,Fila Men Deckers White Shoes,
30509,Women,Apparel,Innerwear,Bra,Beige,Lovable Women Spice Beige Bra,
42915,Women,Accessories,Belts,Belts,Grey,French Connection Women Grey Belt,
46589,Women,Footwear,Shoes,Heels,Gold,Catwalk Women Golden Flats,
54870,Women,Accessories,Jewellery,Necklace and Chains,Gold,Ivory Tag Women Colour Beam Multicolour Necklace,
19083,Women,Apparel,Topwear,Kurtas,Off White,W Women Flower Off White Kurta,
17925,Women,Apparel,Bottomwear,Capris,Blue,Nike Women Casual Blue Capri,
