id,gender,masterCategory,subCategory,articleType,baseColour,productDisplayName,
59505,Women,Accessories,Jewellery,Pendant,Silver,Lucera Silver Pendant With Chain,
32834,Women,Footwear,Shoes,Flats,Black,Grendha Women Flori Black Flats,
24951,Women,Apparel,Topwear,Tshirts,Yellow,United Colors of Benetton Women Yellow T-shirt,
32008,Men,Accessories,Socks,Socks,Black,Playboy Men Black & Green Socks,
38532,Women,Footwear,Shoes,Sports Shoes,Black,Puma Women Black Sports Shoes,
53803,Men,Apparel,Topwear,Tshirts,Red,Puma Men Red T-shirt,
40428,Women,Apparel,Bottomwear,Skirts,Grey,Tonga Women Grey Formal Skirt,
10358,Men,Apparel,Topwear,Tshirts,Blue,United Colors of Benetton Men Solid Polo Blue Tshirts,
15418,Women,Footwear,Shoes,Sports Shoes,White,Fila Women Hex II White Sports Shoes,
45368,Women,Footwear,Shoes,Heels,White,Cobblerz Women White Sandals,
11884,Men,Footwear,Shoes,Formal Shoes,Black,Franco Leone Men Black Formal Shoes,
37748,Men,Apparel,Topwear,Shirts,White,John Players Men White Check Shirt,
4873,Men,Apparel,Topwear,Tshirts,Grey,Levis Kids Boy's Danio Grey Kidswear,
48477,Women,Apparel,Dress,Dresses,Cream,French Connection Women Cream Dress,
18307,Men,Apparel,Topwear,Shirts,Brown,Wills Lifestyle Men Check Brown Shirt,
26408,Men,Apparel,Topwear,Shirts,Grey,Turtle Men Check Grey Shirt,
8682,Men,Accessories,Eyewear,Sunglasses,Brown,Fastrack Men Sunglasses M102BR1,
22894,Men,Footwear,Sandal,Sandals,Brown,Woodland Men Camel Casual Sandals,
28592,Men,Accessories,Wallets,Wallets,Khaki,Peter England Men Khaki Wallet,
50488,Men,Apparel,Innerwear,Trunk,Black,Chromozome Men Black Trunks,
6718,Men,Apparel,Topwear,Tshirts,Brown,Locomotive Men's Ribbed Neck Brown T-shirt,
29440,Men,Accessories,Watches,Watches,Steel,Giordano Men Steel Dial Watch,
42971,Women,Apparel,Bottomwear,Swimwear,Pink,Amante Pink & Blue Swimwear,
58281,Women,Accessories,Bags,Handbags,Olive,Baggit Women Olive Sling Bag,
53669,Women,Accessories,Bags,Handbags,Black,Kiara Women Black Handbag,
21249,Unisex,Accessories,Bags,Duffel Bag,Black,Skybags Unisex Black Duffle Bag,
59353,Women,Apparel,Topwear,Kurtas,Orange,Vishudh Women Orange Printed  Kurta,
38364,Men,Accessories,Wallets,Wallets,Coffee Brown,Peter England Men Dark Brown Wallet,
15840,Women,Apparel,Topwear,Kurtas,Yellow,Visudh Mustard Printed Ethnic Kurta,
12259,Men,Apparel,Topwear,Shirts,Grey,Genesis Grey Formal Shirt,
42529,Women,Apparel,Topwear,Kurtas,Multi,Mother Earth Women Multi Coloured Kurta,
9334,Women,Apparel,Topwear,Tops,Black,Puma Women Heroes Graphic Black Tops,
18763,Women,Apparel,Topwear,Shirts,White,Arrow Woman Ariella White Shirt,
26850,Women,Personal Care,Fragrance,Perfume and Body Mist,Beige,Calvin Klein Women Beauty Perfume,
29024,Men,Apparel,Topwear,Tshirts,Navy Blue,ADIDAS Men Messi Navy Blue T-shirt,
30935,Women,Apparel,Topwear,Kurtis,Blue,Fabindia Women Blue Printed Kurti,
27982,Men,Apparel,Innerwear,Briefs,Charcoal,Jockey ZONE Men Zone Charcoal Brief US14,
19483,Men,Apparel,Topwear,Tshirts,Navy Blue,Puma Men GP Buddh Logo Polo Navy Blue Tshirts,
6972,Women,Apparel,Topwear,Tops,Mauve,s.Oliver Women Printed Mauve Top,
18551,Women,Footwear,Shoes,Flats,Brown,Catwalk Women  Brown Casual Shoe,
48221,Women,Accessories,Eyewear,Sunglasses,Brown,United Colors of Benetton Women Brown Sunglasses,
9106,Women,Apparel,Topwear,Tops,Black,Forever New Women Brown Top,
29216,Women,Accessories,Socks,Socks,White,Fila Women White Socks,
12857,Men,Footwear,Shoes,Casual Shoes,Brown,Lee Cooper Men Brown Casual Shoes,
35649,Men,Footwear,Sandal,Sandals,Black,U.S. Polo Assn. Men Black Sandals,
47269,Men,Apparel,Innerwear,Briefs,Black,FCUK Underwear Men Black Brief,
13985,Men,Footwear,Shoes,Casual Shoes,Black,Puma Men Jiyu 2 Black Casual Shoes,
4619,Women,Apparel,Topwear,Tops,White,Jealous 21 Women Design White Top,
56915,Women,Footwear,Shoes,Heels,Gold,HM Women Golden Heels,
59161,Men,Footwear,Shoes,Formal Shoes,Brown,Fortune Men Brown Shoes,
52589,Women,Accessories,Bags,Clutches,White,Mod'acc Women White Clutch,
38156,Men,Apparel,Topwear,Jackets,Green,Wildcraft Men Green Fleece Sleeveless Jacket,
24509,Women,Apparel,Topwear,Kurtas,Black,Mother Earth Women Black Printed Kurta,
56129,Women,Personal Care,Makeup,Concealer,Skin,ColorBar Instant Coverup Stick Apricot Crush Concealer 001,
1991,Women,Apparel,Topwear,Tshirts,Blue,ADIDAS Womens Blue  Polo T-shirt,
58275,Women,Accessories,Bags,Handbags,Pink,Baggit Women Pink Sling Bag,
15088,Men,Apparel,Topwear,Kurtis,Black,Mother Earth Men Printed Black Kurtis,
38390,Men,Apparel,Topwear,Tshirts,White,ADIDAS Men White Mumbai Indians Print T-shirt,
14966,Men,Accessories,Wallets,Wallets,Brown,Newhide Antique Wallet,
33778,Unisex,Accessories,Socks,Socks,Cream,Puma Unisex Retro Pack of 2 Socks,
41358,Men,Apparel,Bottomwear,Jeans,Blue,Wrangler Men Blue Skanders Jeans,
39242,Women,Apparel,Loungewear and Nightwear,Nightdress,Pink,Femella Women Pink Nightdress,
11428,Women,Apparel,Topwear,Tops,Black,United Colors of Benetton Women  Winter Black Animal Print Top,
19645,Women,Apparel,Topwear,Tops,Brown,United Colors Of Benetton Women Brown Top,
46941,Women,Personal Care,Fragrance,Perfume and Body Mist,Blue,York Women Clematis Perfume,
8212,Men,Accessories,Watches,Watches,Black,Fastrack Men Beach Upgrades Black Watch,
49135,Women,Personal Care,Eyes,Kajal and Eyeliner,Bronze,Deborah 24 Ore Eye Pencil 266,
2728,Girls,Apparel,Topwear,Tops,Pink,Disney Kids Girl's Pink & White Pooh Kidswear,
50824,Men,Accessories,Wallets,Wallets,Brown,New Hide Men Brown Wallet,
18797,Unisex,Accessories,Bags,Handbags,Grey,Peter England Unisex Casual Grey Bag,
31813,Men,Accessories,Watches,Watches,Black,Titan Men Black Dial Watch,
22438,Women,Apparel,Topwear,Kurtis,Blue,Global Desi Women Printed Blue Kurti,
28102,Men,Apparel,Innerwear,Briefs,Grey,Jockey COMFPLUS Men Grey Y Front Briefs 8004,
50018,Women,Apparel,Bottomwear,Leggings,Black,Hanes Women Black Comfortsoft Waistband Cotton - Stretch Lace Capri Leggings,
27976,Men,Apparel,Innerwear,Briefs,Charcoal,Jockey Men Charcoal Zone Stretch Briefs,
6388,Men,Footwear,Shoes,Sports Shoes,Black,Puma Men PowerCat Calcetto Black Shoe,
8020,Men,Apparel,Bottomwear,Track Pants,Black,Fila Men's Single Tipped Woven Black Red Track Pant,
49307,Men,Accessories,Socks,Socks,Brown,Arrow Men Pack Of 5 Basic Plating Socks,
19477,Men,Apparel,Topwear,Jackets,Blue,Quiksilver Men Casual Blue Jacket,
7854,Unisex,Accessories,Bags,Backpacks,White,Nike Unisex White Pink Black Check Backpack,
27378,Men,Apparel,Bottomwear,Jeans,Blue,Spykar Men Washed Blue Jeans,
6986,Women,Apparel,Topwear,Tshirts,Red,s.Oliver Women's Department Refined Red T-shirt,
7068,Women,Apparel,Topwear,Tops,Black,s.Oliver Women Black Tank  Top,
13971,Women,Footwear,Shoes,Sports Shoes,Black,Puma Women Speeder Wn's Black Sports Shoes,
28330,Men,Footwear,Sandal,Sandals,Black,Red Tape Men Casual Black Sandals,
14368,Women,Footwear,Shoes,Heels,Black,Catwalk Women Casual Black Flats,
57833,Men,Apparel,Topwear,Tshirts,Navy Blue,United Colors of Benetton Men Navy Blue T-shirt,
44418,Men,Footwear,Shoes,Casual Shoes,Brown,Red Tape Men Brown Shoes,
36038,Unisex,Accessories,Bags,Handbags,Blue,OTLS Unisex Blue Bag,
20961,Women,Accessories,Bags,Handbags,Beige,Fastrack Women Beige Sling Bag,
36804,Men,Accessories,Watches,Watches,White,Maxima Men White Dial Ssteele Watch,
32498,Men,Footwear,Shoes,Casual Shoes,White,Converse Men CT AS 17 NYC White Shoes,
13529,Men,Apparel,Topwear,Tshirts,Blue,Spykar Blue Stripes Tshirt,
43259,Women,Apparel,Topwear,Kurtas,Purple,Aneri Women Purple Kurta,
9596,Men,Apparel,Topwear,Shirts,White,Scullers Men Scul White Shirts,
8444,Women,Apparel,Topwear,Tshirts,Green,Jealous 21 Women Jealous Eirny Green Top Green T-shirt,
16867,Men,Accessories,Eyewear,Sunglasses,Green,Idee Men Funky Eyewear Green Sunglasses,
49763,Women,Apparel,Bottomwear,Leggings,Grey,Vishudh Grey Leggings,
19013,Women,Apparel,Topwear,Tshirts,Black,ADIDAS Originals Women G Couple Black Tshirt,
28754,Women,Apparel,Topwear,Kurtas,Blue,Aurelia Women Printed Blue Kurta,
17189,Men,Apparel,Topwear,Shirts,Maroon,U.S. Polo Assn. Men Checks Maroon Shirt,
3890,Men,Apparel,Topwear,Tshirts,White,Wrangler Men's Motel Color Block White Blue T-shirt,
25877,Unisex,Accessories,Bags,Backpacks,Purple,American Tourister Unisex Casual Purple Backpack,
52119,Women,Apparel,Topwear,Tops,Navy Blue,Myntra Women Navy Blue Printed Top,
33912,Men,Accessories,Watches,Watches,Black,Citizen Men Black Dial Watch,
45992,Women,Apparel,Saree,Sarees,Pink,Fabindia Pink Mangalgiri Saree,
39414,Men,Apparel,Topwear,Shirts,White,U.S. Polo Assn. Men Blue & White Checked Tailored Fit Smart Casual Shirt,
52925,Women,Apparel,Saree,Sarees,Lavender,FNF Lavender Sari,
44840,Men,Apparel,Topwear,Tshirts,White,Puma Men White Trend T-shirt,
24199,Men,Apparel,Bottomwear,Jeans,Blue,Deni Yo Men Slim Fit Blue Jeans,
11870,Men,Footwear,Shoes,Formal Shoes,Brown,Franco Leone Men Formal Brown Formal Shoes,
5169,Men,Apparel,Topwear,Tshirts,White,Ed Hardy Men's Brave Hearts Stay True Grey T-shirt,
58611,Women,Accessories,Jewellery,Earrings,Black,ToniQ Women Black Earrings,
39626,Men,Footwear,Shoes,Sports Shoes,White,Nike Men Air Max Turnaround Low White Sports Shoes,
4887,Women,Apparel,Topwear,Tops,Pink,Levis Kids Girl's Dana Pink Kidswear,
5955,Men,Apparel,Topwear,Shirts,Yellow,Locomotive Men Yellow Checked Shirt,
48483,Women,Apparel,Dress,Dresses,Blue,French Connection Women Blue Dress,
30599,Men,Apparel,Bottomwear,Shorts,Red,Nike Men Hustle Reversible Red Shorts,
34905,Women,Apparel,Topwear,Dupatta,Brown,Fabindia Red Hand Printed Kota Dupatta,
19221,Men,Accessories,Ties,Ties,Black,United Colors of Benetton Men Check Black Tie,
8676,Unisex,Accessories,Eyewear,Sunglasses,Black,Fastrack Unisex Black Sunglasses,
49551,Women,Accessories,Bags,Handbags,Beige,Rocia Women Beige Handbag,
22860,Men,Footwear,Shoes,Casual Shoes,Black,Woodland Men Black Casual Shoes,
28566,Men,Apparel,Topwear,Tshirts,Black,Nike Men Who Else Black T-shirt,
43857,Women,Accessories,Jewellery,Earrings,Gold,Royal Diadem Earrings,
55932,Women,Personal Care,Nails,Nail Polish,Purple,Colorbar Purple Mania Nail Lacquer 30,
46519,Men,Accessories,Watches,Watches,Cream,Timex Men Cream Toned Dial Watch,
42985,Women,Footwear,Shoes,Sports Shoes,Grey,Nike Women Grey Shoes,
31017,Men,Apparel,Topwear,Shirts,White,Arrow Men White Striped Shirt,
12295,Men,Apparel,Topwear,Shirts,White,Genesis Men Solid White Shirts,
46979,Women,Accessories,Bags,Handbags,Grey,Bulchee Women Grey Handbag,
13347,Women,Apparel,Bottomwear,Jeans,Blue,Spykar Women Washed Blue Jeans,
54480,Men,Apparel,Innerwear,Briefs,Red,Hanes Men String Premium String Bikini Briefs,
28906,Women,Apparel,Topwear,Kurtas,Blue,BIBA Women Printed Blue Kurta,
43437,Women,Apparel,Apparel Set,Kurta Sets,Pink,Global Desi Women Pink & Orange Printed Anarkali Churidar Kurta with Duptatta,
2710,Girls,Apparel,Dress,Dresses,White,Disney Kids Girl's White Daisy Kidswear,
16635,Men,Apparel,Topwear,Tshirts,Black,Facit Men Smart Black Tshirt,
49931,Men,Apparel,Innerwear,Trunk,White,Hanes Men White Trunks,
22400,Men,Apparel,Topwear,Shirts,Blue,Mark Taylor Men Blue Shirt,
7262,Men,Footwear,Shoes,Casual Shoes,Black,Rockport Men's Gavia Black Shoe,
46145,Women,Accessories,Jewellery,Necklace and Chains,Blue,Adrika Blue & Red Necklace,
47097,Boys,Footwear,Shoes,Casual Shoes,Red,Marvel Boys Red Shoes,
34565,Women,Apparel,Dress,Dresses,Black,Tonga Women Printed Black Dress,
50020,Women,Apparel,Bottomwear,Leggings,Navy Blue,Hanes Women Navy Cotton Stretch Leggings,
14162,Men,Accessories,Cufflinks,Cufflinks,Steel,Belmonte Men Bright Assorted Steel Cufflinks,
20357,Men,Apparel,Bottomwear,Jeans,Blue,Spykar Men Washed Blue Jeans,
5535,Men,Footwear,Shoes,Sports Shoes,Grey,Nike Men's Air Max Tailwind Dark Grey Shoe,
44612,Men,Footwear,Shoes,Sports Shoes,Blue,Salomon Men Blue RX Prime Sports Shoes,
36232,Women,Footwear,Shoes,Sports Shoes,White,Nike Women Air Dictate 2 MSL White Sports Shoes,
21285,Women,Accessories,Eyewear,Sunglasses,Gold,Allen Solly Women Sunglasses AS203-C1,
52777,Women,Accessories,Wallets,Wallets,Coffee Brown,Fiorelli Women Coffee Brown Wallet,
33740,Women,Apparel,Topwear,Tops,Green,Vero Moda Women Bale Green Top,
57205,Women,Apparel,Bottomwear,Capris,White,Kraus Jeans Women White Capris,
25625,Women,Accessories,Watches,Watches,White,Fastrack Women White Dial Watch N6013SL01,
11410,Men,Apparel,Topwear,Tshirts,Grey,United Colors of Benetton Men Winter Grey T-shirt,
41360,Men,Apparel,Bottomwear,Jeans,Navy Blue,Wrangler Men Navy Blue Millard Jeans,
5707,Men,Footwear,Shoes,Casual Shoes,Green,Skechers Men's Shaver-Towing Charcoal Shoe,
44420,Men,Footwear,Shoes,Casual Shoes,Brown,Red Tape Men Brown Leather Shoes,
14350,Women,Footwear,Shoes,Heels,Black,Catwalk Women Casual Black Flats,
20165,Men,Apparel,Topwear,Shirts,White,Wrangler Men Biker White Shirt,
39874,Unisex,Accessories,Bags,Backpacks,Black,ADIDAS Unisex Black Load Spring Backpack,
36000,Boys,Apparel,Topwear,Tshirts,Navy Blue,Ben 10 Boys Navy Blue T-shirt,
57037,Women,Apparel,Dress,Dresses,Blue,Elle Women Blue Dress,
58843,Men,Accessories,Cufflinks,Cufflinks,Black,Hakashi Men Black Cufflinks,
33572,Men,Apparel,Topwear,Tshirts,Red,Wrangler Men Broad Striped Polo Red T-shirt,
20959,Men,Accessories,Bags,Backpacks,Black,Fastrack Men Polyester Black Backpack,
40080,Men,Apparel,Topwear,Tshirts,Blue,ADIDAS Men Blue T-shirt,
41152,Women,Apparel,Bottomwear,Skirts,Grey,Allen Solly Woman Grey Skirt,
59991,Women,Apparel,Dress,Dresses,Multi,Avirate Multicoloured Dress,
25417,Men,Footwear,Shoes,Sports Shoes,White,Nike Men Downshifter White Sports Shoes,
11622,Women,Apparel,Topwear,Kurtas,Blue,W Women Check Blue Kurtas,
26292,Men,Apparel,Topwear,Tshirts,Purple,Proline Men Purple Striped Polo T-shirt,
8018,Men,Apparel,Topwear,Tshirts,Green,Fila Men's Black Printed Green T-shirt,
31225,Women,Apparel,Topwear,Tshirts,Black,Puma Women Black Polo T-shirt,
27340,Women,Personal Care,Fragrance,Perfume and Body Mist,Black,Celine Dion Women Belong Perfume,
35685,Men,Footwear,Shoes,Casual Shoes,Navy Blue,U.S. Polo Assn. Men Navy Blue Shoes,
46377,Men,Apparel,Topwear,Shirts,Blue,ADIDAS Men Blue & Black Check Shirt,
8824,Men,Apparel,Topwear,Shirts,Black,Spykar Men Ranger Black Shirts,
16407,Men,Apparel,Topwear,Shirts,Black,Levis Men Solid Black Shirts,
22632,Men,Apparel,Topwear,Tshirts,Black,Nike Men Printed Black T-shirt,
28308,Men,Accessories,Eyewear,Sunglasses,Purple,Fastrack Men Sunglasses P119BR2,
50212,Women,Accessories,Eyewear,Sunglasses,Brown,Stoln Women Brown Sunglasses,
13949,Women,Accessories,Bags,Handbags,Blue,United Colors of Benetton Women Solid Blue Handbags,
34757,Women,Footwear,Shoes,Casual Shoes,Grey,Puma Women Aurora Grey Shoes,
6182,Women,Footwear,Flip Flops,Flip Flops,White,ADIDAS Women's Summer Girl White Flip Flop,
52121,Boys,Apparel,Topwear,Tshirts,Navy Blue,Doodle Boys Navy Blue Printed T-Shirt,
45196,Women,Accessories,Watches,Watches,Cream,CASIO ENTICER Women Cream Dial Analogue Watch A651,
36464,Men,Footwear,Shoes,Casual Shoes,White,Spinn Men Viking White Shoes,
5363,Unisex,Footwear,Shoes,Sports Shoes,White,Btwin Six Mtb Shoes 2009,
44044,Men,Personal Care,Fragrance,Perfume and Body Mist,Green,Hugo Men Limited Edition Perfume,
14734,Men,Apparel,Topwear,Shirts,Black,Arrow Men Stripes Black Shirts,
20501,Women,Accessories,Bags,Handbags,Purple,Baggit Women Pride Taj Purple Handbag,
41536,Men,Accessories,Belts,Belts,Brown,Basics Men Brown Leather Belt,
25073,Men,Accessories,Accessories,Accessory Gift Set,Maroon,Lino Perros Men Formal Maroon Accessory Gift Set,
56581,Women,Personal Care,Makeup,Highlighter and Blush,Skin,Streetwear Crystal Shine Gold Face Brightener Loose Powder,
11246,Unisex,Apparel,Topwear,Sweatshirts,Grey,Urban Yoga Unisex Solid Grey Sweatshirts,
10394,Men,Accessories,Watches,Watches,Red,Puma Men Cardiac Red Watches,
44878,Men,Apparel,Topwear,Tshirts,Blue,Puma Men Blue Striped Polo T-shirt,
33116,Women,Footwear,Shoes,Heels,Black,Catwalk Women Black Stilettos,
43261,Women,Apparel,Topwear,Kurtas,Cream,Aneri Women Cream Kurta,
2146,Men,Apparel,Topwear,Tshirts,Purple,Basics Men Purple Striped T-shirt,
30793,Men,Apparel,Topwear,Shirts,Rust,Fabindia Men Striped Rust Shirt,
27724,Women,Accessories,Bags,Handbags,Beige,Murcia Women Beige Handbag,
13511,Men,Apparel,Topwear,Tshirts,White,Chimp Men Mumbai Opens White Tshirts,
31641,Men,Apparel,Topwear,Shirts,White,Indigo Nation Men White Shirt,
50676,Men,Apparel,Innerwear,Trunk,Grey Melange,Chromozome Men Grey Melange Trunks,
34333,Men,Apparel,Topwear,Tshirts,Purple,Myntra Men Surf Purple T-shirt,
19817,Men,Apparel,Topwear,Sweatshirts,Blue,U.S. Polo Assn. Men Solid Blue Sweatshirt,
7434,Men,Apparel,Topwear,Tshirts,Olive,Proline Men Olive Brown Polo T-shirt,
16063,Men,Apparel,Bottomwear,Trousers,Olive,Highlander Men Solid Olive Trouser,
22256,Women,Footwear,Shoes,Flats,Red,Inc. 5 Women Casual Red Sandals,
27516,Women,Apparel,Innerwear,Briefs,Black,Jockey Lace Stretch Black Boy Leg Brief,
43053,Men,Apparel,Topwear,Tshirts,Black,Nike Men Black T-shirt,
2374,Men,Footwear,Shoes,Casual Shoes,Brown,Red Tape Semi Casual Men's Shoe,
31473,Men,Apparel,Bottomwear,Trousers,Navy Blue,Black Coffee Men Striped Charcoal Trousers,
42181,Men,Footwear,Shoes,Sports Shoes,Silver,Lotto Men Silver & Green Sports Shoes,
22858,Men,Footwear,Shoes,Casual Shoes,Brown,Woodland Men Camel Casual Shoes,
49569,Men,Accessories,Belts,Belts,Black,Reid & Taylor Men Black & Brown Reversible Belt,
19219,Men,Accessories,Ties,Ties,White,United Colors of Benetton Men Striped White Tie,
55136,Women,Personal Care,Nails,Nail Polish,Purple,Lakme Truewear Color Crush 04 Nail Polish,
34101,Boys,Apparel,Topwear,Tshirts,Grey,Doodle Boys Printed Grey T-shirt,
50444,Men,Apparel,Innerwear,Briefs,Navy Blue,Chromozome Men Navy Blue Pack of 2 Briefs,
17383,Men,Accessories,Mufflers,Mufflers,Cream,Reid & Taylor Men Check Cream Muffler,
16251,Men,Apparel,Topwear,Shirts,Red,United Colors of Benetton Men Check Red Shirts,
51596,Women,Apparel,Bottomwear,Jeans,Black,Wrangler Women Black Molly Jeans,
22064,Women,Apparel,Topwear,Kurtas,Green,Vishudh Women Printed Green Kurta,
7606,Women,Footwear,Shoes,Sports Shoes,Purple,Nike Women Ten Purple Shoe,
46521,Men,Accessories,Watches,Watches,Black,Timex Men Black Dial Watch,
11848,Men,Footwear,Flip Flops,Flip Flops,Black,Playboy Men Black Flip Flop,
4083,Men,Apparel,Topwear,Tshirts,Yellow,Inkfruit Men's Alien Party Lemon Yellow T-shirt,
52313,Women,Accessories,Jewellery,Bangle,Multi,ToniQ Women Multi Coloured Bangle,
58629,Women,Accessories,Jewellery,Bangle,Black,ToniQ Women Black Bangles,
14506,Men,Footwear,Shoes,Casual Shoes,Black,Flying Machine Men Casual Black Casual Shoes,
20733,Women,Footwear,Shoes,Heels,Grey,Enroute Women Grey Heels,
37784,Men,Apparel,Topwear,Shirts,Blue,John Players Men Gingham Blue Shirt,
5151,Women,Apparel,Topwear,Tshirts,White,Wrangler Women's Braided Shoulder White T-shirt,
25241,Women,Accessories,Bags,Handbags,Olive,Lino Perros Women Leatherette Olive Handbag,
11074,Men,Apparel,Topwear,Sweaters,Black,Scullers Men Stripes Blue Sweaters,
41704,Women,Footwear,Shoes,Heels,Brown,Catwalk Women Brown Wedges,
57661,Women,Personal Care,Nails,Nail Polish,Gold,Lotus Herbals Gold Mist Nail Polish 972,
24393,Women,Apparel,Topwear,Kurtas,Red,Folklore Women Red Printed Kurta,
21427,Women,Apparel,Topwear,Tops,Blue,Roxy Women Blue Top,
15612,Men,Apparel,Bottomwear,Track Pants,Grey,Nike Men AS Thermal Grey Track Pants,
45162,Men,Accessories,Watches,Watches,Black,Casio ENTICER Men Black Dial Watch A516 MTP-1305D-1AVDF,
4245,Men,Apparel,Topwear,Tshirts,Navy Blue,Probase Men's I'M So Broke Navy T-shirt,
5397,Men,Footwear,Shoes,Sports Shoes,Black,Artengo Artengo Bad 650 Man,
37542,Boys,Accessories,Gloves,Gloves,White,Madagascar 3 Infant Boys White Mittens,
24969,Men,Apparel,Topwear,Tshirts,Red,United Colors of Benetton Men Red T-shirt,
53007,Women,Apparel,Saree,Sarees,Blue,FNF Blue Printed Sari,
25087,Men,Accessories,Wallets,Wallets,Brown,Lino Perros Men Leather Brown Wallet,
56575,Women,Personal Care,Makeup,Foundation and Primer,Skin,Streetwear Beige Stay On 3 in 1 Makeup,
10360,Women,Apparel,Dress,Dresses,Black,United Colors of Benetton Women Black Dress,
24155,Women,Apparel,Topwear,Kurtas,Green,Aurelia Women Green Kurta,
40410,Women,Apparel,Topwear,Tops,Red,Tonga Women Red & Black Top,
17979,Unisex,Footwear,Shoes,Casual Shoes,Black,Puma Unisex Black Hip Hop Shoes,
30767,Men,Apparel,Topwear,Kurtas,Brown,Fabindia Men Brown Silk Kurta,
12437,Unisex,Accessories,Headwear,Caps,Green,Timberland Unisex Casual Green Caps,
26602,Men,Footwear,Shoes,Sports Shoes,Grey,Puma Men Ikonis 2 Grey Sports Shoes,
8488,Women,Apparel,Topwear,Tops,Grey,Forever New Women Slate Grey Tops,
3060,Men,Apparel,Topwear,Tshirts,Beige,Tantra Men's Imagine Beige T-shirt,
50682,Men,Apparel,Innerwear,Trunk,Black,Chromozome Men Black Trunks,
47635,Women,Footwear,Shoes,Heels,Pink,Carlton London Women Pink Peep Toes,
6512,Men,Apparel,Topwear,Tshirts,Green,ADIDAS Men's Light Green T-shirt,
18931,Men,Apparel,Topwear,Tshirts,Blue,Levi's Men Graphic Print Blue Tshirt,
35215,Unisex,Accessories,Bags,Backpacks,Red,Wildcraft Unisex Red & Grey Backpack,
51750,Women,Footwear,Shoes,Heels,Brown,Catwalk Women Brown Flats,
30555,Men,Accessories,Eyewear,Sunglasses,Black,Opium Men Black Sunglass,
9768,Men,Apparel,Topwear,Jackets,Black,ADIDAS Men Adna Black Jackets,
2380,Men,Footwear,Shoes,Casual Shoes,Black,Red Tape Black Men Semi Casual Shoe,
3252,Men,Footwear,Shoes,Sports Shoes,Black,Puma Men's Suede Archive Black White Shoe,
42175,Men,Apparel,Topwear,Tshirts,White,Status Quo Men White T-shirt,
12605,Women,Apparel,Topwear,Tops,Black,Jealous 21 Women Stripes Black Tops,
26430,Women,Accessories,Bags,Handbags,Brown,Spice Art Women Leatherette Brown Handbag,
47407,Women,Accessories,Wallets,Wallets,Purple,Baggit Women Purple Wallet,
6720,Men,Apparel,Topwear,Tshirts,Grey,Locomotive Men's Polo Black T-shirt,
23142,Men,Apparel,Topwear,Sweatshirts,Red,Quechua Men Fleece Red Sweatshirt,
17377,Men,Accessories,Accessories,Accessory Gift Set,Purple,Arrow Men Formal Purple Tie+Cufflink+Pocket square - Combo Pack,
51562,Men,Accessories,Watches,Watches,Black,Fastrack Men Black Dial Watch 3062pp02b,
42949,Men,Accessories,Belts,Belts,Brown,French Connection Men Brown Leather Belt,
35027,Women,Accessories,Stoles,Stoles,Yellow,Fabindia Women Yellow Stole,
45350,Women,Footwear,Shoes,Heels,Black,Cobblerz Women Black Sandals,
4077,Women,Footwear,Shoes,Casual Shoes,Black,Numero Uno Women Dark Black Shoe,
21615,Women,Apparel,Innerwear,Bra,Purple,Enamor Women Smooth Purple Bra,
37770,Men,Apparel,Topwear,Shirts,Green,John Players Men Green Ginghams Shirt,
44282,Unisex,Accessories,Bags,Backpacks,Grey,Skybags Unisex Grey Backpack,
11080,Men,Apparel,Topwear,Shirts,Green,Scullers Men Check Green Shirts,
32202,Men,Apparel,Topwear,Kurtas,Red,Fabindia Men Printed Red Kurta,
38738,Unisex,Accessories,Bags,Backpacks,Grey,Nike Unisex Grey Brasilia Medium Backpack,
40622,Women,Apparel,Topwear,Kurtas,Pink,Span Women Floral Printed Pink Kurta,
5999,Men,Apparel,Topwear,Shirts,Blue,Highlander Men Blue White Checked Slim Fit Shirt,
10152,Men,Footwear,Shoes,Casual Shoes,Black,Rockport Men TR Bal Black Casual Shoes,
24367,Women,Apparel,Topwear,Kurtas,Green,Folklore Women Green  Kurta,
3636,Men,Footwear,Flip Flops,Flip Flops,Green,Puma Men's Winglet Green Black Flip Flop,
29820,Men,Apparel,Topwear,Shirts,Red,Basics Men Red Checked Shirt,
42511,Women,Apparel,Topwear,Kurtis,Red,Mother Earth Women Red Kurti,
26054,Men,Apparel,Topwear,Shirts,Purple,John Miller Men Striped Purple Shirt,
27186,Men,Apparel,Bottomwear,Trousers,Black,Mark Taylor Men Striped Grey Trousers,
7296,Men,Apparel,Topwear,Tshirts,Grey,Free Authority Men's Don't Stop Can't Stop Grey T-shirt,
26868,Women,Apparel,Topwear,Tshirts,Lavender,Jealous 21 Women Printed Lavender T-shirt,
47063,Women,Apparel,Bottomwear,Patiala,Multi,Shree Women Multi Colored Patiala,
6344,Men,Footwear,Shoes,Casual Shoes,Black,Converse Men Black CT Lace Color Hi Canvas Shoes,
34591,Women,Apparel,Dress,Dresses,Multi,Tonga Women Printed Multi Dress,
23526,Men,Personal Care,Fragrance,Perfume and Body Mist,Green,Hugo Boss Men EDT Perfume,
17713,Men,Apparel,Topwear,Shirts,Blue,Reid & Taylor Men Check Blue Shirt,
53651,Women,Accessories,Bags,Handbags,Blue,Kiara Women Blue Handbag,
37314,Men,Accessories,Watches,Watches,Black,CASIO Edifice Men Black Dial Analogue Watch ED444,
4413,Men,Apparel,Topwear,Tshirts,Brown,Nirvana Men's Wings Brown T-shirt,
21271,Unisex,Accessories,Bags,Backpacks,Grey,Footloose Unisex Grey Backpack,
15044,Boys,Apparel,Topwear,Tshirts,Yellow,ADIDAS Kids Boys Printed Yellow Tshirts,
24703,Unisex,Footwear,Sandal,Sports Sandals,Black,Puma Unisex 4M Blur Black Sports Sandals,
56323,Women,Accessories,Watches,Watches,White,Fastrack Women White Dial Watch,
15878,Unisex,Footwear,Flip Flops,Flip Flops,Yellow,Warner Bros Kids Unisex TJ Big Face Yellow Slippers,
38952,Boys,Apparel,Topwear,Tshirts,Navy Blue,Gini and Jony Boys Pack of 2 T-shirts,
53463,Women,Apparel,Innerwear,Bra,Pink,Amante Pink Full-Coverage Lace Bra BCLC11,
20191,Men,Apparel,Topwear,Tshirts,Grey,Wrangler Men Grey Polo T-shirt,
15276,Men,Accessories,Socks,Socks,White,Nike Men pack of 3 Sports Socks,
39880,Unisex,Accessories,Bags,Backpacks,Black,ADIDAS Unisex Black Skate Check Backpack,
4621,Women,Apparel,Topwear,Tops,Purple,Jealous 21 Women Knit Purple Top,
10704,Women,Accessories,Watches,Watches,Steel,Esprit Women Organic Pretty Black Houston Steel Watches,
24531,Women,Apparel,Topwear,Kurtas,Orange,Mother Earth Women Orange Printed Kurta,
33586,Men,Apparel,Topwear,Tshirts,Purple,Wrangler Men Timeless Lifestyle Purple T-shirt,
40074,Women,Apparel,Bottomwear,Tights,Navy Blue,ADIDAS Women Navy Blue Tights,
59965,Women,Apparel,Dress,Dresses,Black,Avirate Black Dress,
32454,Men,Apparel,Topwear,Tshirts,White,ADIDAS Men White T-shirt,
56111,Women,Personal Care,Lips,Lip Gloss,Maroon,Colorbar Wine Not Lip Pot 016,
