id,gender,masterCategory,subCategory,articleType,baseColour,productDisplayName,
15970,Men,Apparel,Topwear,Shirts,Navy Blue,Turtle Check Men Navy Blue Shirt,
39386,Men,Apparel,Bottomwear,Jeans,Blue,Peter England Men Party Blue Jeans,
59263,Women,Accessories,Watches,Watches,Silver,Titan Women Silver Watch,
21379,Men,Apparel,Bottomwear,Track Pants,Black,Manchester United Men Solid Black Track Pants,
53759,Men,Apparel,Topwear,Tshirts,Grey,Puma Men Grey T-shirt,
1855,Men,Apparel,Topwear,Tshirts,Grey,Inkfruit Mens Chain Reaction T-shirt,
30805,Men,Apparel,Topwear,Shirts,Green,Fabindia Men Striped Green Shirt,
26960,Women,Apparel,Topwear,Shirts,Purple,Jealous 21 Women Purple Shirt,
29114,Men,Accessories,Socks,Socks,Navy Blue,Puma Men Pack of 3 Socks,
30039,Men,Accessories,Watches,Watches,Black,Skagen Men Black Watch,
1163,Men,Apparel,Topwear,Tshirts,Blue,Nike Sahara Team India Fanwear Round Neck Jersey,
48123,Women,Accessories,Belts,Belts,Black,Fossil Women Black Huarache Weave Belt,
18653,Men,Footwear,Flip Flops,Flip Flops,Black,Fila Men Cush Flex Black Slippers,
47957,Women,Accessories,Bags,Handbags,Blue,Murcia Women Blue Handbag,
46885,Boys,Footwear,Flip Flops,Flip Flops,Navy Blue,Ben 10 Boys Navy Blue Slippers,
12369,Men,Apparel,Topwear,Shirts,Purple,Reid & Taylor Men Check Purple Shirts,
29928,Men,Accessories,Watches,Watches,Black,Police Men Black Dial Watch PL12889JVSB,
42419,Girls,Apparel,Topwear,Tops,White,Gini and Jony Girls Knit White Top,
51832,Women,Apparel,Innerwear,Bra,Beige,Bwitch Beige Full-Coverage Bra BW335,
47359,Women,Accessories,Bags,Handbags,Brown,Baggit Women Brown Handbag,
17429,Men,Accessories,Watches,Watches,Black,CASIO G-Shock Men Black Digital Watch G-7710-1DR G223,
12967,Men,Footwear,Sandal,Sandals,Black,ADIDAS Men Spry M Black Sandals,
6842,Unisex,Accessories,Shoe Accessories,Shoe Accessories,Black,Timberland Unisex Rubber Sole Brush Shoe Accessories,
13089,Men,Apparel,Topwear,Sweatshirts,Grey,ADIDAS Men Lfc Auth Hood Grey Sweatshirts,
18461,Men,Personal Care,Fragrance,Deodorant,White,David Beckham Signature Men Deos,
9036,Men,Footwear,Shoes,Formal Shoes,Black,Buckaroo Men Flores Black Formal Shoes,
48311,Women,Accessories,Jewellery,Bracelet,Bronze,Pitaraa Women Bronze Beaded Bracelet,
7990,Men,Apparel,Topwear,Tshirts,Navy Blue,Fila Men's Round Neck Navy Blue T-shirt,
56019,Women,Personal Care,Lips,Lipstick,Brown,Colorbar Soft Touch Show Stopper Copper Lipstick 037,
21977,Women,Accessories,Bags,Handbags,Brown,Murcia Women Casual Brown Handbag,
37812,Men,Apparel,Topwear,Shirts,Navy Blue,John Players Men Navy Blue Shirt,
4729,Boys,Apparel,Topwear,Tshirts,Green,Disney Kids Boy's Crew Sea Life Sialing Green Teen Kidswear,
56825,Men,Apparel,Topwear,Shirts,Brown,John Players Men Brown Shirt,
39988,Men,Footwear,Shoes,Casual Shoes,White,Gas Men Europa White Shoes,
59051,Women,Footwear,Shoes,Flats,Black,Carlton London Women Black & Gold Toned Flats,
20099,Women,Apparel,Topwear,Kurtas,Green,Diva Women Embroided Green Kurta,
58183,Women,Accessories,Bags,Handbags,White,Rocky S Women White Handbag,
29742,Women,Accessories,Bags,Handbags,Teal,Kiara Women Teal Handbag,
51658,Women,Accessories,Watches,Watches,Copper,Fossil Women Copper Chronograph Watch CH2589,
3954,Women,Apparel,Topwear,Tshirts,Pink,Jealous 21 Women's Pink T-shirt,
18839,Men,Accessories,Belts,Belts,Black,Peter England Men Formal Black Belt,
2886,Women,Footwear,Shoes,Flats,Brown,Catwalk Women Leather Brown Flats,
23278,Men,Accessories,Watches,Watches,Off White,Maxima Ssteele Men Off White Watch,
28690,Women,Apparel,Topwear,Kurtas,Beige,W Women Printed Beige Kurta,
8580,Men,Apparel,Topwear,Waistcoat,Grey,Scullers Men  Grey Waistcoat,
3168,Men,Footwear,Shoes,Sports Shoes,White,Nike Men's Incinerate MSL White Blue Shoe,
6969,Women,Apparel,Topwear,Shirts,Green,s.Oliver Women's Green Blouse Shirt,
19498,Women,Accessories,Socks,Socks,White,Puma Women Heritage Quarters Pack of 3 Socks,
12070,Women,Apparel,Topwear,Kurtas,White,W Women Printed White Kurtas,
42700,Women,Footwear,Shoes,Flats,Bronze,Rocia Women Bronze Sandal,
3427,Men,Apparel,Topwear,Tshirts,Black,Myntra Men's I Have Healing Hand Black T-shirt,
24176,Women,Apparel,Topwear,Kurtis,Green,Aurelia Women Green Kurti,
10343,Women,Apparel,Topwear,Tshirts,Blue,United Colors of Benetton Women Solid Blue Tshirts,
1542,Men,Footwear,Shoes,Sports Shoes,White,Puma Men's Ballistic Rubber Shoe,
40433,Women,Apparel,Bottomwear,Skirts,Multi,Tonga Women Multi Colored Skirt,
53818,Women,Apparel,Topwear,Kurtis,Pink,Ayaany Women Pink Kurti,
38529,Men,Footwear,Shoes,Sports Shoes,Black,Puma Men Black Sports Shoes,
56556,Women,Personal Care,Lips,Lip Gloss,Pink,Streetwear Smooch Lip Gloss 42,
11291,Men,Apparel,Bottomwear,Jeans,Blue,Wrangler Men Blue Millard Jeans,
44093,Men,Personal Care,Fragrance,Perfume and Body Mist,Grey,Boss Men Perfume,
37561,Girls,Apparel,Topwear,Rompers,Pink,Madagascar3 Infant Girls Pink Snapsuit Romper,
53024,Women,Apparel,Saree,Sarees,Multi,FNF Multi Coloured Printed Sari,
15631,Men,Apparel,Bottomwear,Track Pants,Navy Blue,Nike Men Navy Cricket Track Pants,
21404,Men,Apparel,Topwear,Tshirts,White,Locomotive Men Printed White T-shirt,
4266,Men,Footwear,Shoes,Sports Shoes,Purple,Nike Men's Mercurial Purple Shoe,
25898,Women,Apparel,Bottomwear,Leggings,Brown,Femella Women Dark Brown Skinny Leggings,
45141,Men,Accessories,Watches,Watches,Black,Casio Enticer Men Black Analogue Watch MTP-1290D-1A1VDF(A413),
29669,Men,Apparel,Topwear,Shirts,White,Indigo Nation Men Printed White Shirt,
17166,Men,Apparel,Topwear,Shirts,Maroon,U.S. Polo Assn. Men Checks Maroon Shirt,
18912,Men,Apparel,Topwear,Shirts,Red,Levis Men Classics Formula One Red Shirt,
6531,Unisex,Accessories,Bags,Backpacks,Blue,Nike Unisex Allegian Blue Backpack,
47616,Women,Footwear,Shoes,Flats,Brown,Portia Women Brown Flats,
26621,Men,Footwear,Shoes,Sports Shoes,White,Puma Men Kevler Runner White Sports Shoes,
12414,Men,Accessories,Wallets,Wallets,Black,Reid & Taylor Men Casual Black Wallets,
3043,Women,Footwear,Shoes,Heels,Blue,Catwalk Women Summer Blue Flats,
16888,Men,Accessories,Eyewear,Sunglasses,Black,Police Men Casual Black Sunglasses,
31696,Women,Apparel,Topwear,Kurtas,Orange,Folklore Women Printed Orange Kurta,
2191,Men,Apparel,Bottomwear,Shorts,Blue,ADIDAS Men Chelsea Lead Short,
9579,Women,Accessories,Bags,Duffel Bag,Black,Puma Women Black Core Lite Grip Duffle Bag,
30744,Men,Apparel,Topwear,Kurtas,Blue,Fabindia Men Blue Printed Kurta,
16286,Men,Apparel,Topwear,Tshirts,Green,Peter England Men Printed Green TShirt,
51541,Women,Accessories,Watches,Watches,Beige,Fastrack Women Beige Watch,
35004,Women,Accessories,Stoles,Stoles,Black,Fabindia Women Printed Black Stole,
6703,Women,Apparel,Topwear,Tshirts,White,UCB Women's Epaulettes On Sleeve White T-shirt,
47424,Women,Accessories,Wallets,Wallets,Brown,Baggit Women Brown Bonkers Dhamal Wallet,
50493,Men,Apparel,Innerwear,Innerwear Vests,Maroon,Chromozome Men Maroon Innerwear Vest,
28589,Men,Accessories,Belts,Belts,Brown,Peter England Men Leather Brown Belt,
23161,Men,Apparel,Topwear,Tshirts,Navy Blue,Mark Taylor Men Navy Blue Printed T-shirt,
3271,Men,Apparel,Topwear,Tshirts,Red,Guerrilla Men's Poison Blood Red T-shirt,
8699,Women,Accessories,Eyewear,Sunglasses,Purple,Fastrack Women Sunglasses P172PR3F,
12626,Men,Apparel,Topwear,Tshirts,Navy Blue,Probase Men Printed Navy Blue Tshirts,
54033,Women,Accessories,Bags,Handbags,Teal,Kiara Women Teal Handbag,
30576,Men,Accessories,Eyewear,Sunglasses,Black,Opium Men Aviator Black Sunglass,
43084,Women,Apparel,Topwear,Tshirts,Green,Nike Women Green T-shirt,
40601,Women,Apparel,Topwear,Kurtas,Green,Span Women Printed Green Kurta,
1526,Unisex,Accessories,Bags,Backpacks,Black,Puma Big Cat Backpack Black,
24344,Men,Apparel,Topwear,Tshirts,Blue,ADIDAS Men Blue T-shirt,
10171,Men,Footwear,Shoes,Formal Shoes,Brown,United Colors of Benetton Men vertigo Brown Shoes,
4868,Men,Apparel,Topwear,Tshirts,Orange,Levis Kids Boy's Darby Orange Polo Tshirt,
25296,Women,Accessories,Bags,Handbags,Olive,Lino Perros Women Sporty Olive Handbag,
32221,Women,Apparel,Topwear,Kurtas,Purple,Fabindia Women Purple & Blue Striped Kurta,
37753,Men,Apparel,Topwear,Shirts,Blue,John Players Men Stripes Blue Shirt,
5186,Men,Apparel,Topwear,Tshirts,Black,Dark Knight Men's Joker Color Splash Black T-shirt,
4054,Men,Apparel,Topwear,Tshirts,Black,Myntra Men's Hard Work Never Killed Anyone Black T-shirt,
45373,Women,Footwear,Shoes,Heels,Black,Cobblerz Women Black Sandals,
24182,Men,Footwear,Shoes,Casual Shoes,Green,Converse Men Green Casual Shoes,
57470,Men,Footwear,Shoes,Casual Shoes,Grey,Playboy Men Grey High Cut Lace Up Casual Shoes,
33135,Women,Footwear,Shoes,Heels,Bronze,Catwalk Women Bronze Heels,
11265,Men,Apparel,Bottomwear,Trousers,Black,Indigo Nation Men TR Yarn Dyed Black Trousers,
25050,Men,Accessories,Accessories,Accessory Gift Set,Brown,Lino Perros Men Formal Brown Accessory Gift Set,
45989,Women,Apparel,Saree,Sarees,Green,Fabindia Green Mangalagiri Saree,
5340,Men,Footwear,Shoes,Casual Shoes,Brown,Fila Men's Union Beige Royal Shoe,
37595,Boys,Apparel,Topwear,Tshirts,Blue,Madagascar3 Boys Printed Blue T-Shirt,
20522,Women,Accessories,Bags,Handbags,Black,Baggit Women Hail Taj Black Handbag,
14717,Women,Apparel,Topwear,Tops,Black,Jealous 21 Women Casual Top Black Tops,
33909,Men,Accessories,Watches,Watches,Gold,Citizen Men Gold Dial Watch,
52102,Women,Apparel,Topwear,Kurtas,Cream,Myntra Women Cream Printed Kurta,
4292,Men,Apparel,Topwear,Tshirts,Black,Tantra Men's Shanti Black T-shirt,
36447,Men,Footwear,Shoes,Sports Shoes,White,Spinn Men Orbit White Sports Shoes,
7417,Women,Apparel,Topwear,Kurtas,Blue,W Women Sqaure Neck Short Sleeve Blue Kurta,
19834,Men,Apparel,Topwear,Shirts,Blue,U.S. Polo Assn. Men Blue Checked Shirt,
22275,Women,Footwear,Shoes,Heels,White,Inc. 5 Women Casual White Flats,
17192,Men,Apparel,Topwear,Shirts,Maroon,U.S. Polo Assn. Men Stripes Maroon Shirt,
50655,Men,Apparel,Loungewear and Nightwear,Lounge Shorts,Grey Melange,Chromozome Men Grey Melange Lounge Shorts,
34310,Women,Accessories,Stoles,Stoles,Black,Fabindia Women Black Silk & Wool Stole,
19008,Women,Apparel,Topwear,Tshirts,Black,ADIDAS Originals Women Graphic Black Tshirt,
42390,Women,Apparel,Topwear,Tshirts,Grey,Flying Machine Women Grey T-shirt,
31662,Men,Apparel,Topwear,Shirts,Green,Indigo Nation Men Printed Teal Shirt,
2165,Men,Apparel,Topwear,Shirts,Blue,Probase Men Check Blue Shirt,
43242,Men,Footwear,Shoes,Sports Shoes,White,Reebok Men White Swift Chase Sports Shoes,
13532,Men,Footwear,Shoes,Sports Shoes,Blue,ADIDAS Blue Resp Trail 18 M Sports Shoe,
16272,Men,Apparel,Topwear,Shirts,Red,Levis Men Red & White Striped Shirt,
46502,Men,Accessories,Watches,Watches,Green,Timex Men Green Dial Watch,
7625,Men,Accessories,Belts,Belts,Brown,Wrangler Men Dark Brown Leather Belt,
55929,Women,Personal Care,Nails,Nail Polish,Purple,Colorbar Plum Wine Nail Lacquer 41,
34122,Unisex,Accessories,Bags,Duffel Bag,Khaki,Turtle Unisex Khaki Duffle Bag,
50467,Men,Apparel,Innerwear,Trunk,Charcoal,Chromozome Men Charcoal Trunks,
23195,Men,Apparel,Topwear,Shirts,Green,Highlander Men Green Striped Shirt,
31450,Men,Apparel,Topwear,Tshirts,Blue,Nike Men Blue Sleeveless T-Shirt,
3285,Men,Apparel,Topwear,Tshirts,Yellow,Guerrilla Men's Move It Move On Green T-shirt,
55115,Women,Personal Care,Makeup,Compact,Skin,Lakme Absolute White Intense Ivory Fair Wet & Dry Compact 01,
13700,Men,Footwear,Shoes,Sports Shoes,White,ADIDAS Men Elite Speed White Sports Shoes,
2357,Men,Accessories,Accessories,Water Bottle,White,ADIDAS White Water Sipper,
48498,Women,Apparel,Bottomwear,Trousers,Grey,French Connection Women Black Trousers,
43070,Unisex,Accessories,Headwear,Caps,Red,Nike Unisex Red Portugal Football Cap,
33307,Boys,Apparel,Bottomwear,Jeans,Grey,Gini and Jony Boys Washed Grey Jeans,
57642,Women,Personal Care,Nails,Nail Polish,Peach,Lotus Herbals Peach Perfect Nail Polish 99,
10185,Men,Apparel,Topwear,Shirts,White,Indigo Nation Men Price catch White Shirts,
11057,Men,Apparel,Topwear,Shirts,Purple,Scullers Men Check Purple Shirt,
25262,Women,Accessories,Bags,Handbags,Beige,Lino Perros Women Canvas Beige Handbag,
41727,Women,Footwear,Shoes,Heels,White,Catwalk Women White Heels,
20710,Men,Footwear,Shoes,Casual Shoes,Black,Red Tape Men Black Casual Shoes,
44255,Women,Accessories,Wallets,Wallets,Black,Hidekraft Women Black Wallet,
5172,Women,Apparel,Topwear,Tshirts,Orange,Inkfruit Women's Innocence Carrot Orange T-shirt,
45387,Women,Footwear,Shoes,Flats,Black,Rocia Women Black Flats,
52330,Women,Accessories,Wallets,Wallets,Black,ToniQ Women Black Wallet,
6393,Men,Footwear,Sandal,Sandals,Blue,Lotto Men Revenge 02 Royal Blue Floater,
34546,Men,Accessories,Belts,Belts,Black,Puma Men Patch Webbing Black Belt,
50003,Women,Apparel,Innerwear,Bra,Black,Hanes Women Black Cotton Stretch Shirred Crop Top Bra,
28119,Men,Apparel,Innerwear,Briefs,Brown,Jockey MC Men Pack Of Two Brown Briefs 8003,
16616,Men,Apparel,Topwear,Shirts,Green,Probase Men Stripes Green Shirt,
7241,Men,Footwear,Shoes,Formal Shoes,Brown,Rockport Men's Abraim Brown Shoe,
13364,Men,Footwear,Shoes,Casual Shoes,Beige,Timberland Men Toddler Beige Casual Shoes,
47888,Women,Accessories,Bags,Handbags,Pink,Murcia Women Pink Handbag,
27151,Men,Apparel,Topwear,Shirts,Blue,Mark Taylor Men Striped Blue Shirt,
28925,Men,Apparel,Topwear,Tshirts,Blue,Mr. Men Printed Blue T-shirt,
8209,Men,Apparel,Topwear,Tshirts,Grey,Locomotive Men Stripe Lann Grey T-Shirts,
26083,Men,Apparel,Topwear,Shirts,Yellow,John Miller Men Striped Yellow Shirt,
55571,Women,Personal Care,Fragrance,Deodorant,Blue,Revlon Women Deo,
11433,Women,Apparel,Topwear,Sweaters,Mauve,United Colors of Benetton Women Light Winter Mauve Vest,
25606,Men,Accessories,Watches,Watches,Black,Fastrack Men Casual Black Watches,
39259,Men,Footwear,Shoes,Casual Shoes,Khaki,Red Chief Men Khaki Shoes,
40291,Unisex,Footwear,Flip Flops,Flip Flops,Red,Warner Bros Kids Unisex Red Flip Flops,
33763,Men,Footwear,Shoes,Casual Shoes,Olive,ADIDAS Neo Men Ez Desert Boot Olive Shoes,
57226,Women,Accessories,Bags,Handbags,Black,Murcia Women Black Handbag,
36211,Boys,Apparel,Bottomwear,Shorts,Blue,Gini Jony Boys Blue Shorts,
52754,Women,Accessories,Bags,Handbags,Black,Fiorelli Women Black and Taupe Leather Handbag,
15093,Women,Apparel,Topwear,Tunics,Brown,Mother Earth Women Solid Brown Tunics,
20374,Women,Apparel,Topwear,Tshirts,Black,Urban Yoga Women Printed Black Tshirt,
14141,Men,Accessories,Cufflinks,Cufflinks,Steel,Belmonte Men Bright Assorted Steel Cufflinks,
53686,Women,Accessories,Bags,Handbags,Purple,Kiara Women Purple & Yellow Handbag,
44631,Men,Apparel,Bottomwear,Track Pants,Black,Nike Men Black Track Pants,
5516,Men,Apparel,Topwear,Tshirts,White,Probase Men's Crack Print Crew Challenger White T-shirt,
11601,Women,Apparel,Topwear,Kurtas,Cream,W Women Solid Cream Kurtas,
25434,Men,Accessories,Socks,Socks,White,Lee Men Casual Tripack Socks,
57014,Women,Footwear,Shoes,Flats,Multi,HM Women Multicoloured Heels,
58860,Men,Accessories,Cufflinks,Cufflinks,Copper,Hakashi Men Copper Cufflinks,
33551,Men,Apparel,Topwear,Shirts,Blue,Wrangler Men Atlanta Dark Base Striped Blue Shirt,
39857,Boys,Apparel,Topwear,Tshirts,Yellow,Gini And Jony Boys Printed Yellow T-Shirt,
36023,Men,Accessories,Belts,Belts,Black,OTLS Men Black Leather Belt,
44403,Men,Footwear,Shoes,Sports Shoes,Olive,Force 10 Men Olive Shoes,
5724,Unisex,Footwear,Sandal,Sandals,Black,Reebok Unisex Drive Black Floater,
20146,Men,Apparel,Topwear,Shirts,Navy Blue,Wrangler Men Urban Navy Blue Shirt,
14373,Women,Footwear,Shoes,Heels,Brown,Catwalk Women Casual Brown Flats,
38985,Boys,Apparel,Topwear,Tshirts,Red,Gini and Jony Boys Comics Red T-shirt,
50231,Women,Accessories,Eyewear,Sunglasses,Lavender,Stoln Women Lavender Sunglasses,
34774,Women,Accessories,Bags,Handbags,Black,Be For Bag Women Pack of 3 Bag,
47286,Women,Accessories,Wallets,Wallets,Black,Baggit Women Black Horris Excel Wallet,
7073,Unisex,Accessories,Bags,Backpacks,Orange,Wildcraft Unisex Orange & White Printed Backpack,
22611,Men,Apparel,Topwear,Tshirts,Green,Nike Men Green Jersey,
16424,Men,Apparel,Topwear,Tshirts,Blue,Levi's Men Printed Blue  Tshirts,
8807,Men,Apparel,Topwear,Shirts,Green,Scullers Men Scul Black & Green Check Shirt,
1828,Men,Footwear,Shoes,Sports Shoes,White,Nike Men's Air Afterburner Shoe,
54691,Women,Apparel,Topwear,Kurtas,Multi,Shree Women Multicoloured Printed Kurta,
13156,Men,Apparel,Topwear,Tshirts,Green,Puma Men Jersey Green Polo Tshirts,
12084,Women,Apparel,Topwear,Kurtas,Blue,W Women Printed Blue Kurtas,
31206,Men,Accessories,Accessories,Accessory Gift Set,Brown,Cabarelli Men Brown Accessory Gift Set,
23143,Women,Apparel,Topwear,Sweatshirts,Magenta,Quechua Women  Fleece Magenta Sweatshirt,
17376,Men,Accessories,Accessories,Accessory Gift Set,Red,Arrow Men Formal Red Tie+Cufflink+Pocket square - Combo Pack,
47406,Women,Accessories,Wallets,Wallets,Red,Baggit Women Red Border Lisa Wallet,
6721,Men,Apparel,Topwear,Tshirts,White,Locomotive Men's Fateeion White T-shirt,
35026,Women,Accessories,Stoles,Stoles,Red,Fabindia Women Red Stole,
51563,Men,Accessories,Watches,Watches,White,Fastrack Men White Watch,
29479,Men,Accessories,Watches,Watches,White,Giordano Men White Dial Watch,
42948,Men,Accessories,Belts,Belts,Black,French Connection Men Black Leather Belt,
22091,Men,Footwear,Shoes,Casual Shoes,Brown,Numero Uno Men Casual Brown Shoes,
2381,Men,Footwear,Shoes,Formal Shoes,Brown,Red Tape Men's Brown Formal Shoe,
9769,Men,Apparel,Bottomwear,Tracksuits,Navy Blue,ADIDAS Men Navy Blue Tracksuit,
12604,Women,Apparel,Topwear,Tops,Purple,Jealous 21 Women Printed Purple Tops,
26431,Women,Accessories,Bags,Handbags,Grey,Spice Art Women Leatherette Grey Handbag,
3253,Men,Footwear,Shoes,Casual Shoes,Black,Puma Men's Volley Black Shoe,
42174,Men,Apparel,Topwear,Tshirts,Blue,Status Quo Men Blue T-shirt,
32203,Men,Apparel,Topwear,Kurtas,Blue,Fabindia Men Printed Blue Kurta,
11081,Men,Apparel,Topwear,Shirts,Red,Scullers Men Check Red Shirts,
57694,Women,Personal Care,Skin,Face Moisturisers,White,Lotus Herbals Alpha Hydroxy Oil-Free Moisturiser,
10153,Men,Footwear,Shoes,Formal Shoes,Brown,Rockport Men Drsp SLip On Brown Formal Shoes,
5998,Men,Apparel,Topwear,Shirts,Blue,Highlander Men Blue Red Plaid Checked Shirt,
24366,Women,Apparel,Topwear,Kurtas,Cream,Folklore Women Cream  Kurta,
38739,Unisex,Accessories,Bags,Backpacks,Black,Nike Black Backpack,
40623,Women,Apparel,Topwear,Kurtas,Red,Span Women Floral Printed Red Kurta,
45351,Women,Footwear,Shoes,Heels,Brown,Cobblerz Women Brown Sandals,
2314,Men,Apparel,Topwear,Tshirts,Black,Nike Mens JDI Black T-shirt,
37771,Men,Apparel,Topwear,Shirts,Yellow,John Players Men Gingham Yellow Shirt,
56574,Women,Personal Care,Makeup,Foundation and Primer,Skin,Streetwear Stay On Pearl 3 in 1 Make Up,
32031,Men,Accessories,Socks,Socks,White,Playboy Men Pack Of 3 Socks,
40411,Women,Apparel,Topwear,Tops,White,Tonga Women White Printed Top,
10361,Men,Apparel,Topwear,Tshirts,Purple,United Colors of Benetton Men Graphic Printed Purple Tshirts,
24154,Women,Apparel,Topwear,Kurtas,Orange,Aurelia Women Orange Kurta,
45163,Men,Accessories,Watches,Watches,Maroon,CASIO ENTICER Men Maroon Dial Analogue Watch A518,
4244,Men,Apparel,Topwear,Tshirts,Navy Blue,Probase Men's Against All Odds Navy T-shirt,
21426,Women,Apparel,Topwear,Tshirts,Pink,Roxy Women Pink T-shirt,
15613,Men,Apparel,Bottomwear,Shorts,Black,Nike Men Runng Black Shorts,
53006,Women,Apparel,Saree,Sarees,Multi,FNF Multi Coloured Printed Sari,
37543,Boys,Apparel,Topwear,Tshirts,Yellow,Madagascar3 Infant Boys Lemon Yellow T-Shirt,
5396,Men,Footwear,Shoes,Sports Shoes,White,Artengo Artengo Bad 414 I Man,
47634,Women,Footwear,Shoes,Heels,Red,Carlton London Women Red Heels,
18930,Men,Apparel,Topwear,Tshirts,Red,Levi's Men Graphic Print Red Tshirt,
6513,Women,Apparel,Topwear,Tshirts,Pink,UCB Women's Basic Neck Light Pink T-shirt,
28799,Men,Apparel,Bottomwear,Jeans,Blue,Denizen Men Blue Jeans,
17144,Women,Accessories,Belts,Belts,Grey,Lino Perros Women Solid Grey Belt,
50683,Men,Apparel,Innerwear,Trunk,Brown,Chromozome Men Pack of Two Trunks,
51751,Women,Footwear,Shoes,Flats,Blue,Catwalk Women Blue Shoes,
16096,Unisex,Accessories,Eyewear,Sunglasses,Black,M tv Unisex My Fab Eyewear Black Sunglasses,
35214,Unisex,Accessories,Bags,Backpacks,Grey,Wildcraft Unisex Reflex Grey Backpack,
43294,Women,Free Items,Free Gifts,Free Gifts,Maroon,Murcia Women Maroon Elektra Sling Bag,
17978,Men,Footwear,Shoes,Casual Shoes,Red,Puma Men Funpack Red Casual Shoe With Extra Lace,
30766,Men,Apparel,Topwear,Kurtas,Blue,Fabindia Men Blue Matka Silk Kurta,
3061,Men,Apparel,Topwear,Tshirts,Yellow,Tantra Men's E BO Yellow T-shirt,
8489,Women,Apparel,Topwear,Tops,Beige,Forever New Women Shell Beige Tops,
12436,Men,Accessories,Socks,Socks,Blue,Timberland Men Casual Blue Socks,
26603,Men,Footwear,Shoes,Casual Shoes,Black,Puma Men Fox Black Sports Shoes,
33587,Men,Apparel,Topwear,Tshirts,Purple,Wrangler Men Pixelate Poster Purple T-shirt,
40075,Men,Apparel,Topwear,Tshirts,Black,ADIDAS Men Black Jersey,
10705,Women,Accessories,Watches,Watches,Silver,Esprit Women Twist Black Houston Silver Watches,
24530,Women,Apparel,Topwear,Kurtas,Blue,Mother Earth Women Blue Kurta,
2580,Women,Apparel,Bottomwear,Capris,Black,Domyos Women Black Capri,
32455,Men,Apparel,Topwear,Tshirts,White,ADIDAS Men Polo White T-shirt,
59964,Women,Apparel,Dress,Dresses,Black,Avirate Women Black Dress,
53462,Women,Apparel,Innerwear,Bra,Maroon,Amante Maroon T-Shirt Bra,
38953,Boys,Apparel,Topwear,Tshirts,Navy Blue,Gini and Jony Boys Pack of 2 T-shirts,
20190,Men,Apparel,Topwear,Tshirts,Blue,Wrangler Men Broad Blue T-shirt,
4620,Women,Apparel,Topwear,Tops,Black,Jealous 21 Women Knit Black Top,
21042,Women,Footwear,Shoes,Heels,Black,Clarks Women Aerial Flower Black Heels,
39881,Unisex,Accessories,Bags,Backpacks,Black,ADIDAS Unisex Black Backpack,
15277,Men,Accessories,Socks,Socks,Black,Nike Men pack of 3 Sports Socks,
51335,Men,Accessories,Socks,Socks,Black,Raymond Men Black Socks,
35670,Men,Footwear,Shoes,Casual Shoes,Navy Blue,U.S. Polo Assn. Men Navy Blue Shoes,
46382,Men,Apparel,Topwear,Tshirts,Blue,ADIDAS Men Blue Printed T-shirt,
47250,Men,Apparel,Innerwear,Briefs,Grey Melange,FCUK Underwear Men Grey Melange Brief,
6177,Men,Apparel,Topwear,Tshirts,Blue,Lee Men's Cosmos Blue Lapis T-shirt,
23715,Men,Accessories,Eyewear,Sunglasses,Gold,Ray-Ban Men Aviator Sunglasses,
9903,Men,Apparel,Bottomwear,Jeans,Blue,Spykar Men Ep Skinny Low Waist Fit Blue Jeans,
3405,Women,Accessories,Bags,Handbags,Blue,Murcia Women Teal Blue Handbag,
33766,Men,Footwear,Shoes,Casual Shoes,Blue,ADIDAS Neo Men Court Evo Blue Shoes,
12052,Men,Apparel,Topwear,Tshirts,White,Spykar Men White Polo T-Shirts,
55795,Women,Apparel,Loungewear and Nightwear,Night suits,Pink,SDL by Sweet Dreams Women Pink & Black Printed Night Suit 319371,
26267,Men,Apparel,Topwear,Tshirts,Purple,Proline Men Purple Polo T-Shirt,
18568,Men,Footwear,Shoes,Casual Shoes,White,Puma Men Benecio Canvas White Casual Shoes,
33924,Women,Accessories,Watches,Watches,Silver,Citizen Women White Dial Watch,
13180,Men,Footwear,Shoes,Sports Shoes,Silver,Fila Men Dls Maxim Silver Sports Shoes,
48218,Women,Accessories,Eyewear,Sunglasses,Black,United Colors of Benetton Women Black Sunglasses,
30302,Men,Apparel,Topwear,Tshirts,Off White,Myntra Men Evil Minds Off White T-shirt,
35442,Girls,Apparel,Topwear,Tops,White,Doodle Girls Printed White Top,
7297,Men,Apparel,Topwear,Tshirts,Brown,Jimi Hendrix Men's Jimi Experience Brown Melange T-shirt,
26869,Women,Apparel,Topwear,Tshirts,Green,Jealous 21 Women Printed Green T-shirt,
23527,Men,Personal Care,Fragrance,Deodorant,Grey,Hugo Boss XY Men Deo,
48816,Women,Accessories,Jewellery,Pendant,Silver,Lucera Women Silver Pendant,
17712,Women,Footwear,Shoes,Casual Shoes,Grey,Vans Women E-Street Grey Casual Shoes,
47062,Women,Apparel,Bottomwear,Patiala,Multi,Shree Women Multi Colored Patiala,
34590,Women,Apparel,Topwear,Tops,Red,Tonga Women Printed Red Top,
6345,Unisex,Footwear,Shoes,Casual Shoes,Purple,Converse Unisex Brick Purple Shoe,
19688,Men,Apparel,Bottomwear,Shorts,Navy Blue,United Colors of Benetton Men Navy Blue Check Shorts,
12260,Men,Apparel,Topwear,Shirts,Blue,Genesis Blue Striped Formal Shirt,
26055,Men,Apparel,Topwear,Shirts,Blue,John Miller Men Check Blue Shirt,
3637,Men,Footwear,Shoes,Casual Shoes,Black,Fila Men's Cameo Black Shoe,
42510,Women,Apparel,Topwear,Kurtis,Maroon,Mother Earth Women Maroon Kurti,
29821,Men,Apparel,Topwear,Shirts,Green,Basics Men Green Checked Shirt,
27187,Men,Apparel,Topwear,Tshirts,Brown,Mark Taylor Men Printed Brown T-shirt,
54475,Women,Accessories,Bags,Handbags,Blue,Baggit Women Blue Small Handbag,
24702,Men,Footwear,Shoes,Casual Shoes,Green,Puma Men Mid Spill Green Casual Shoes,
41395,Men,Apparel,Topwear,Shirts,Red,Wrangler Men Navy & Red Checked Slim Fit Casual Shirt,
15879,Unisex,Footwear,Sandal,Sandals,Black,Warner Bros Kids Unisex TJ Jerry  Black Sandals,
56322,Women,Accessories,Watches,Watches,Black,Fastrack Women Black Dial Watch,
37315,Men,Accessories,Watches,Watches,White,CASIO Edifice Men White Dial Chronograph Watch EX006,
14197,Women,Apparel,Dress,Dresses,Black,AND Women Solid Black Dresses,
21270,Unisex,Accessories,Bags,Backpacks,Black,Footloose Unisex Polyester Black Backpack,
52782,Women,Accessories,Wallets,Wallets,Red,Fiorelli Women Red Wallet,
15045,Boys,Apparel,Topwear,Tshirts,Black,ADIDAS Kids Boys Printed Black Tshirts,
45735,Women,Apparel,Topwear,Kurtas,Cream,Folklore Women Cream Kurta,
4412,Men,Apparel,Topwear,Tshirts,Black,Pink Floyd Black Original Dark Side Black T-shirt,
58842,Men,Accessories,Cufflinks,Cufflinks,Black,Hakashi Men Black Cufflinks,
20958,Men,Apparel,Topwear,Tshirts,Grey,s.Oliver Men Solid Grey Tshirt,
40081,Men,Apparel,Topwear,Tshirts,White,ADIDAS Men White & Green T-shirt,
57036,Women,Apparel,Dress,Dresses,Black,Forever New Women Printed Black Dress,
25416,Men,Footwear,Shoes,Sports Shoes,Black,Nike Men Court Majestic Black Sports Shoes,
